Company_Brand,Founded,HeadQuarter,Sector,What_it_does,Founders,Investor,Amount,Stage,Year
Wellness Forever,2008,Mumbai,Healthcare And Health Technology,Wellness Forever is the one-stop destination for wellness,"Ashraf Biran, Gulshan Bakhtiani, Mohan Chavan","Poonawalla, Allana Group",100000000.0,Equity,2020
MoooFarm,2019,Gurugram,Agriculture And Technology,MoooFarm is an information technology company that bridges the technology gap to help marginalized dairy farmers.,"Param Singh, Aashna Singh, Abhijeet Mittal, Jitesh Arora","Navus Ventures, Rockstart",500000.0,Ideation,2020
BitClass,2020,Bangalore,Technology And Software,BitClass is a PaaS solution which helps teachers set up their independent live classes,"Gunjan Kejriwal, Utsav Tiwary","AET Japan, Figure Eight Investments, Waterbridge Ventures",2000000.0,Validation,2020
Gonuts,2020,Mumbai,Technology And Software,Personalised Video shoutouts from favourite celebrity.,"Vinamra Pandiya, Mayank Gupta, Joji George","Sweta Rau, Archana Priyadarshini",400000.0,Validation,2020
Uolo,2013,Bangalore,Education And Learning,Uolo Technology is founded by paranoid parents who want to make a difference to preschool experience.,"Pallav Pandey, Ankur Pandey, Siddharth Singh","Rajul Garg, Purvi Capital",2000000.0,Validation,2020
Kirana King,2014,Jaipur,E-Commerce And Retail,"A revolutionary idea of standardization, digitization & centralization to traditional Grocery system.",Anup Kumar,Rajasthan Venture Capital Fund,900000.0,Validation,2020
iKure,2010,Kolkata,Healthcare And Health Technology,iKure is a social enterprise that delivers primary healthcare and wellness & prevention services to communities in India,Sujay Santra,"Ratan Tata, Inflection Point Ventures, Ankur Mittal",4000000.0,Debt,2020
Reliance Retail,2006,Mumbai,E-Commerce And Retail,Reliance Retail Ventures Limited is a subsidiary company of Reliance Industries Limited.,Mukesh Ambani,"Abu Dhabi Investment Authority, GIC",10000000.0,Equity,2020
Ather Energy,2013,Bangalore,Automotive,Ather Energy is a manufacturer of electric scooters.,"Arun Vinayak, Swapnil Jain, Tarun Mehta",HeroMotoCorp Ltd and Sachin Bansal,35000000.0,Scaling,2020
Routematic,2007,Bangalore,Technology And Software,Vision is to enable a safer and more comfortable commute to work for employees of India Inc.,"Sriram Kannan, Surajit Das","VAMM Ventures, Naresh Malhotra",2000000.0,Debt,2020
LivFin,2017,New Delhi,Finance And Technology,LivFin is a non-banking financial company registered with the Reserve Bank of India (RBI),Rakesh Malhotra,"DEG, KFW DEG",4700000.0,Debt,2020
Universal Sportsbiz Pvt Ltd,2012,Bangalore,Technology And Software,A fashion startup based in Bengaluru.,Anjana Reddy,"Accel, Alteria Capital",4000000.0,Debt,2020
Lattu Kids,2017,Mumbai,Education And Learning,Lattu kids is an edutainment platform for preschool kids.,Vivek Bhutyani,Mumbai Angels Network,4000000.0,Debt,2020
Eggoz,2016,Indore,Consumer Goods And Services,"Eggoz is a brand of fresh and chemical-free eggs, produced in tech-enabled & nutrition-engineered deep integration partnership with farmers.","Abhishek Negi, Aditya Singh, Pankaj Pandey, Uttam Kumar","AVANA Capital, Rebright Partners",1500000.0,Validation,2020
Steradian Semiconductors,2016,Bangalore,Technology And Software,Semiconductor company focused on CMOS millimeter wave products for Radar.,"Gireesh Rajendran, Ashish Lachhwani, Apu Sivadas, Rakesh Kumar and Alok Joshi",Endiya Partners.,4000000.0,Debt,2020
CHARGE+ZONE,2018,Gujarat,Energy And Environment,"Charge+Zone provides services in renewable energy solutions, product development, and software engineering company.","Kartikey Hariyani, Pavan Bakeri",Mumbai Angels,3000000.0,Validation,2020
Stones2milestones,2008,Gurugram,Education And Learning,Stones2milestones is India (Delhi) Based EdTech Company,"Kavish Gadia, Nikhil Saraf","Menterra Venture Advisors, Emandi Sankara Rao",2000000.0,Validation,2020
AjnaLens,2014,Thane,Technology And Software,"AjnaLens develops AR/VR wearables primarily for the Defence, Education and enterprise customers.","Abhijit Patil, Abhishek Tomar, Pankaj Raut","Mohsin Hani Al Bahrani, MoD",1000000.0,Validation,2020
Gully Network,2019,Bangalore,E-Commerce And Retail,Gully Network is a tech-enabled network of mid-sized grocery stores.,"Ajay Nain, Prateek Chaturvedi","CP Ventures, Orios Venture Partners",1200000.0,Validation,2020
TurboHire,2018,Hyderabad,Technology And Software,Talent Intelligence Platform for enterprises that helps recruiters discover the right candidates for a job using a Human-like AI,"Abhishek Kabra, Aman Gour","Kia Ora Ventures, Pentathlon Ventures",1000000.0,Validation,2020
Charcoal Eats,2015,Mumbai,Technology And Software,"In the last five years, have served over 1.5 million orders and enjoy high customer satisfaction.","Anurag Mehrotra, Krishnakant Thakur, Mohammed Bhol, Gautam Singh",Lokmat Investments,2000000.0,Debt,2020
Mitron TV,2020,Bangalore,Human Resources And Consultancy,Mitron is a free short videoplatform for next generation,"Shivank Agarwal, Anish Khandelwal",9Unicorns,4000000.0,Debt,2020
Svami,2016,Mumbai,Consumer Goods And Services,Svami is the result of three seasoned drinkers extending their love for libations to the larger world of drinks.,Sahil Jatana,"Niren Shah, Rukam Capital Trust",800000.0,Debt,2020
Dhurnia,2018,Dhingsara,Education And Learning,Developer of an online learning platform intended for various competitive exam preparations.,"Ajay Kumar, Murari Singh","Chandigarh Angels Network, Modulor Capital",100000.0,Debt,2020
Expertrons,2019,Mumbai,Education And Learning,Expertrons is an AI video bot platform created to help students and professionals prepare for interviews.,Jatin Solanki,"Rohit Chanana, Sukanta Ganguly",4000000.0,Debt,2020
Bizlog,2016,Bangalore,Transport And Logistics,Bizlog Value Chain enables re-commerce and circular economy through unique REVERSE LOGISTICS engine.,"HS Srinivasan, Krishnan Rajan, E.V. Shunmugam",IAN Fund,1000000.0,Debt,2020
Tamasha.live,2020,Mumbai,Consumer Goods And Services,"Tamasha offers a platform for influencers to host live, video based, real money contests and games.","Saurabh Gupta, Siddharth Swarnkar","9Unicorns, Titan Capital, FirstCheque",300000.0,Debt,2020
Fedo,2017,Bangalore,Technology And Software,Artificial Intelligence based Credit Score for Health,"Arun Mallavarapu, Prasanth Madavana",AIM Smart City,1000000.0,Debt,2020
FabHotels,2015,Gurugram,Consumer Goods And Services,Fabhotels is the online aggregator for hotel rooms. It aims to provide standardized services at economical budgets.,"Adarsh Manpuria, Vaibhav Aggarwal","RB Investments Pte. Ltd, Goldman Sachs",1000000.0,Debt,2020
Freshokartz,2016,Jaipur,Agriculture And Technology,"Freshokartz provides soil data based crop and fertilisers recommendation to farmers and delivery seeds, pesticides","Chandrakanta, Rajendra Lora","Rajasthan Venture Capital Fund, Innovana Thinklabs",1000000.0,Validation,2020
FlexiLoans,2016,Mumbai,Finance And Technology,"an online lending platform started with an endeavour to solve the problem that SMEs face in accessing Quick, Flexible and Adequate funds for growing their Businesses.","Abhishek Kothari, Deepak Jain, Manish Lunia, Ritesh Jain",>Vikram Sud,6000000.0,Debt,2020
Agrix,2020,Patna,Agriculture And Technology,"Farming-as-a-service (covering farm machinery and agri input services) and provides market linkages, especially for fragmented farm owners.","Nilay Pandey, Saurav Singh, Vivek Kumar",Maple Capital Advisors,4000000.0,Debt,2020
BharatAgri,2017,Pune,Agriculture And Technology,A Smart Farming Technology Platform for Indian Farmers,"Siddharth Dialani, Sai Gole","021 Capital, India Quotient",4000000.0,Validation,2020
FreshtoHome,2015,Bangalore,E-Commerce And Retail,Freshtohome is an e-commerce platform for fresh and chemical-free seafood.,Shan Kadavil,"Ascent Capital, Iron Pillar",121000000.0,Scaling,2020
Credable,2017,Mumbai,Finance And Technology,CredAble provides working capital & supply chain finance programs for large enterprises and their suppliers and distributors.,Nirav Choksi,Oaks Asset Management,4500000.0,Debt,2020
Railofy,2019,Mumbai,Transport And Logistics,Railofy is a WL & RAC protection that enables waitlisted passengers to reach their destination at the lowest possible price.,"Rohan Dedhia, Vaibhav Saraf, Hrishabh Sanghvi","Roots Ventures, Better Capital",5000000.0,Validation,2020
Finova Capital,2016,Jaipur,Finance And Technology,Finova Capital is a non-banking financial company.,"Mohit Sahney, Sunita Sahney","Sequoia Capital India, Faering Capital",55000000.0,Equity,2020
Teachmint,2020,Bangalore,Education And Learning,Teachmint is an easy to use platform for tutors to conduct unlimited live classes and manage their classrooms,"Mihir, Payoj Jain, Divyansh Bordia, Anshuman Kumar",Lightspeed India,3500000.0,Validation,2020
Peel-Works,2010,Mumbai,E-Commerce And Retail,Peel-Works is a tech and data analytics company specializing in e-commerce for corner stores.,"Sachin Chhabra, Nidhi Ramachandran","CESC Ventures, Brun Raschle",3000000.0,Debt,2020
Janani,2020,Bangalore,Technology And Software,Janani aims to make the process of infertility treatment and assisted fertilisation easier,Nilay Mehrotra,9Unicorns,200000.0,Ideation,2020
Credgenics,2018,Gurugram,Finance And Technology,"Credgenics is a tech-enabled platform backed by Titan Capital, helping fintech lenders and Banks in their critical NPA reduction","Anand Agrawal, Mayank Khera, Rishabh Goel","Accel, Sunder Nookala",3300000.0,Validation,2020
Finelistings,2015,New Delhi,Technology And Software,A Used Luxury Car Marketplace,Aneesh Mathur,Justdial,4000000.0,Debt,2020
Wellversed,2018,New Delhi,Healthcare And Health Technology,Wellversed Health enables production of customised clinical food products specific to health requirements of a demography or an individual.,"Aanan Khurma, Aditya Seth, Ripunjay Chachan","KLUB Works, Shankar Narayanan",4000000.0,Validation,2020
Nykaa,2012,Mumbai,Consumer Goods And Services,Nykaa is an online marketplace for different beauty and wellness products.,Falguni Nayar,"Alia Bhatt, Katrina Kaif",4000000.0,Debt,2020
Jumbotail,2015,Bangalore,E-Commerce And Retail,"Jumbotail is solving an important problem of organising food and grocery ecosystem in India through technology, data science and design.","Ashish Jhina, Karthik Venkateswaran",Nexus Venture Partners and 23 High Networth Individuals (HNIs),11000000.0,Scaling,2020
Winzo,2018,New Delhi,Consumer Goods And Services,WinZO is a mobile e-sports social gaming platform that offers monetary benefits and prizes to players.,"Paavan Nanda, Saumya Singh Rathore","Makers Fund, Courtside Ventures",2000000.0,Debt,2020
mCaffeine,2015,Mumbai,Consumer Goods And Services,"MCaffeine is a personal care brand that offers caffein-infused face, body, and hair care products.","Tarun Sharma, Vikas Lachhwani","RPSG Ventures, Amicus Capital",5000000.0,Scaling,2020
Pocket FM,2018,Bangalore,Media And Entertainment,Pocket FM is an audiobook & podcast app that brings you over 10K+ popular audiobooks.,Rohan Nayak,"Times Group, Lightspeed",5000000.0,Early Traction,2020
Snackible,2015,Mumbai,Healthcare And Health Technology,Snackible operates a health-food production company designed to sell healthy snack food via online and offline channels.,Not filled,"Mumbai Angels, Murali Nair",4000000.0,Validation,2020
FreshtoHome,2015,Bangalore,E-Commerce And Retail,Freshtohome is an e-commerce platform for fresh and chemical-free seafood.,Shan Kadavil,"Ascent Capital, Iron Pillar",16000000.0,Equity,2020
Jumbotail,2015,Bangalore,E-Commerce And Retail,Jumbotail is solving an important problem of organising food and grocery ecosystem in India,"Ashish Jhina, Karthik Venkateswaran","Nexus Venture Partners, Capria Ventures",11000000.0,Scaling,2020
Nykaa,2012,Mumbai,E-Commerce And Retail,Nykaa is an online marketplace for different beauty and wellness products.,Falguni Nayar,"Katrina Kaif, Steadview Capital",4000000.0,Debt,2020
TagZ Foods,2019,Bangalore,Consumer Goods And Services,TagZ Foods is a supplier of snacks and food products.,"Sagar Bhalotia, Anish Basu Roy","Exfinity Venture Partners, Shesh Kondi",4000000.0,Debt,2020
Genius Teacher,2016,Mumbai,Education And Learning,"Genius Teacher creates engaging educational content, delivers fun learning experience to the students","Advitiya Sharma, Gaurav Lahoti","Sandeep Tandon, Daniel Lapus",2000000.0,Debt,2020
Krimanshi Feeds,2015,Jodhpur,Technology And Software,Krimanshi aims to increase rural income by improving the productivity of Indian cattle with better quality feed.,Nikhil Bohra,"Rajasthan Venture Capital Fund, AIM Smart City",500000.0,Debt,2020
Origo,2010,Gurugram,Agriculture And Technology,Provider of marketing and warehousing services for agricultural commodities.,"Sunoor Kaul,",Northern Arc Capital,4000000.0,Debt,2020
GetVantage,2019,Mumbai,Finance And Technology,GetVantage is India and Southeast Asia's first fintech enabled Revenue-based financing platform.,"Amit Srivastava, Bhavik Vasa, Sachin Tagra, Sachin Tagra","Samyakth Capital, Venture Catalysts",5000000.0,Validation,2020
Betterplace,2015,Bangalore,Technology And Software,Developer of a digital verification platform designed to manage the semi-formal workforce.,"Saurabh Tandan, Pravin Agarwala",Jungle Ventures,10000000.0,Scaling,2020
Biddano,2016,Mumbai,Healthcare And Health Technology,India's 1st tech-enabled healthcare logistics platform.,Talha Shaikh,Windrose Capital,600000.0,Validation,2020
InVideo,2017,Mumbai,Human Resources And Consultancy,InVideo enables you to transform your content into great videos.,"Harsh Vakharia, Pankit Chheda, Sanket Shah","Base Partners, Sequoia Capital India",15000000.0,Early Traction,2020
Arzooo,2016,Bangalore,E-Commerce And Retail,"Retail tech platform empowering 300,000+ small retailers in electronics space to compete with big organised players and increase sales","Khushnud Khan, Rishi Raj Rathore","3Lines, Jabbar Internet Group",7500000.0,Early Traction,2020
BASIC Home Loan,2020,Gurugram,Finance And Technology,"A platform for automating home loans for middle and low-income households in India,",Atul Monga,Picus Capital,5000000.0,Validation,2020
SUGAR cosmetics,2012,Mumbai,Consumer Goods And Services,It is a cruelty-free makeup brand providing cosmetics that is high on style and higher on performance.,"Kasuhik Mukherjee, Vineeta Singh","A91 Partners, RB Investments Pte. Ltd",2000000.0,Debt,2020
Signzy,2015,Bangalore,Finance And Technology,It is creating 'building blocks for a Digital Trust system.,"Ankit Ratan, Ankur Pandey, Arpit Ratan","GenNext Ventures, Contrarian Drishti Partners",5400000.0,Debt,2020
Ahaguru,2012,Chennai,Education And Learning,"It is conducting IIT JEE Coach for Physics, Math and Chemistry easily.","Gomathi S, Dr Balaji Sampath",Anand Mahindra,4000000.0,Early Traction,2020
EzeRx,2018,Kolkata,Education And Learning,Developer and manufacturer of medical devices,"Amit mandahar, Chaitali roy","Indian Oil Corporation, Krishna Chakravarty",200000.0,Validation,2020
Genius Teacher,2016,Mumbai,Education And Learning,"Genius Teacher creates engaging educational content, delivers fun learning experience to the students","Advitiya Sharma, Gaurav Lahoti","Whiteboard Capital, VKG Ventures LLP.",2000000.0,Debt,2020
Ultraviolette Automotive,2014,Bangalore,Automotive,Ultraviolette Automotive is a technology startup working on electric two-wheelers and energy infrastructure.,"Narayan Subramaniam, Niraj Rajmohan",TVS Motor Company,4000000.0,Scaling,2020
Tring,2019,Mumbai,Media And Entertainment,"Tring is a celebrity engagement platform, for all occasions including birthday, anniversaries, get well soon messages.","Akshay Saini, Rahul Saini, Pranav Chabhadia","Sujeet Kumar, Hemesh Singh",4000000.0,Debt,2020
Rare Planet,2015,Kolkata,E-Commerce And Retail,Rare Planet sells handicrafts made by local artisans.,"Ranodeep Saha, Vijay Kumar",Venture Catalysts,400000.0,Validation,2020
GoodGamer,2020,Bangalore,Consumer Goods And Services,GoodGamer is India's first Daily Fantasy Sports and true Esports gaming platform.,Charles Creighton,Not filled,2500000.0,Validation,2020
InnAccel,2012,Bangalore,Education And Learning,"A building a portfolio of novel medical devices designed, engineered, and priced for global Emerging Markets.",Siraj Dhanani,Mount Judi Ventures,1500000.0,Validation,2020
SoOLEGAL,2015,New Delhi,Human Resources And Consultancy,"SoOLEGAL is a global integrated directory of lawyers, legal aid organizations, and Law firms.",Manish Kaul,Not filled,4000000.0,Debt,2020
HobSpace,2019,Mumbai,Education And Learning,India's Activity Hub for Kids,"Priya Goel Sheth, Harsh Jain",Artha Venture,200000.0,Validation,2020
Supplynote,2015,Noida,Technology And Software,Supplynote is India's leading procurement platform with a unique stack of SAAS and E-commerce to solve the procurement problem,"Abhishek Verma, Harshit Mittal, Kumar Kushang, Nitin Prakash","MOX, SOSV",500000.0,Validation,2020
Harmonizer India,2019,Bangalore,Technology And Software,"Energy-efficient solutions based on the Artificial Intelligence, Machine Learning and Internet of Things technology,",M R Srinivas,Kapil Dev,4000000.0,Debt,2020
Zomato,2008,Gurugram,Consumer Goods And Services,Zomato is a food delivery and restaurant discovery site that provides information and reviews about restaurants.,"Deepinder Goyal, Gaurav Gupta, Pankaj Chaddah","Kora, Tiger Global Management",52000000.0,Equity,2020
Dukaan,2020,Mumbai,Technology And Software,Developer of an android application designed for businesses to sell online.,"Subhash Choudhary, Suumit Shah","Lightspeed, Matrix Partners.",6000000.0,Validation,2020
CredR,2014,Mumbai,Technology And Software,India’s Only 100% Inspected and Certified Used Bikes Marketplace.,"Nikhil Jain, Nittin Mittal, Sumit Chhazed","Eight Roads Ventures, On Mauritius",2000000.0,Debt,2020
Satyukt,2018,Bangalore,Agriculture And Technology,An agritech company that provides business to business (B2B) agricultural data,"Sat Tomer, Yukti Gill","NABVENTURES, Social Alpha (India)",500000.0,Validation,2020
RACEnergy,2018,Hyderabad,Automotive,RACEnergy builds and deploys battery swapping infrastructure for use in various segments of vehicles.,"Arun Sreyas, Gautham Maheswaran","growX Ventures, Huddle (Incubator)",4000000.0,Debt,2020
TREAD,2020,Bangalore,Technology And Software,A homegrown fitness startup that aims to advance the 'Fit India' initiative by offering holistic and affordable workouts.,Dinesh Godara,"Better Capital, Kunal Shah, Gaurav Munjal",1100000.0,Ideation,2020
Anveshan,2019,Bangalore,Consumer Goods And Services,Provide quality and healthy food products,"Aayushi Khandelwal, Akhil Kansal, Kuldeep Parewa",Titan Capital,100000.0,Ideation,2020
TeaMonk,2016,Bangalore,Consumer Goods And Services,India's Finest Specialty Tea company.,"Amit Dutta, Ashok Mittal","Lead Angels Network, Roots Ventures",900000.0,Validation,2020
Fleetx,2017,Gurugram,Technology And Software,"Fleetx is an intelligent data platform which uses AI, machine learning, sensors and predictive analytics to help fleet owners.","Abhay Jeet Gupta, Parveen Kataria, Udbhav Rai, Vineet Sharma, Vishal Mishra","Rohit Bansal, Rohan Ranavat",3000000.0,Early Traction,2020
ReNEWate,2018,Pune,Real Estate And Housing,"Tech platform helping millions of renovation contractors, property improvement professionals and businesses manage their business digitally.",Supratik Ghatak,Real Estate Accelerator Program,4000000.0,Ideation,2020
Tango Eye,2018,Chennai,Technology And Software,Retail Video Analytics SaaS product,Surender Gounder,"Riso Investments, Lenskart",4000000.0,Validation,2020
Rare Planet,2015,Kolkata,Technology And Software,Rare Planet sells handicrafts made by local artisans.,"Ranodeep Saha, Vijay Kumar",Venture Catalysts,4000000.0,Validation,2020
Avataa Me,2014,Bangalore,Technology And Software,AVATAAR.ME is a deep-tech 3D AR platform which delivers personalized fashion discovery experience to users on mobile devices.,Gaurav Baid,Sequoia Capital India,7000000.0,Early Traction,2020
MikeLegal,2017,Gurugram,Human Resources And Consultancy,MikeLegal is an AI powered legal associate that aims to build an ecosystem of legal tools,"Tushar Bhargava, Anshul Gupta","SOSV, Artesian",4000000.0,Validation,2020
Miko,2015,Mumbai,Technology And Software,"Miko is an advanced robotics startup founded by three IIT Bombay post-graduates on the pillars of robotics, AI & IoT.","Chintan Raikar, Prashant Iyengar, Sneh Vaswani","Stride Ventures, YourNest Venture Capital",3000000.0,Early Traction,2020
Razorpay,2014,Bangalore,Finance And Technology,"Razorpay is a platform that enables businesses to accept, process, and disburse payments.","Harshil Mathur, Shashank Kumar","Tiger Global Management, Sequoia Capital India",100000000.0,Scaling,2020
Ninjacart,2015,Bangalore,Consumer Goods And Services,"Ninjacart is a business-to-business fresh produce supply chain that connects farmers, manufactures, and brands to retailers directly.","Ashutosh Vikram, Kartheeswaran K K, Sharath Loganathan, Thiru Nagarajan, Thirukumaran Nagarajan, Vasu Devan","Syngenta Ventures, Walmart",30000000.0,Equity,2020
Wow! Momo,2008,Kolkata,Consumer Goods And Services,Wow! Momo is a chain of fast-food restaurants that specializes in momos.,"Binod Kumar Homagai, Sagar Daryani, Shah Miftaur Rahman","Tiger Global Management, William Bissell",5000000.0,Debt,2020
Pepper Content,2017,Mumbai,Marketing And Advertising,Pepper Content is a Content-Mediation Platform that connects talented writers to organisations that require content.,"Anirudh Singla, Rishabh Shekhar","Alok Mittal, Manan Maheshwari",4200000.0,Early Traction,2020
LIVSPACE,2014,Bangalore,Real Estate And Housing,"Livspace is an interior design startup that offers a platform that connects people to designers, services, and products.","Anuj Srivastava, Ramakant Sharma, Shagufta Anurag","Mercer Investments, Bessemer Venture Partners",4000000.0,Debt,2020
Acculi Labs,2017,Bangalore,Healthcare And Health Technology,Acculi Labs is a clinical grade smartphone based diagnostic tool,"HariPrasath M., Rupam Das",Startup Basket.,600000.0,Validation,2020
Unnati,2017,Noida,Agriculture And Technology,A helping hand to the farming community through Artificial Intelligence,"Amit Sinha, Ashok Prasad",NABVENTURES,1700000.0,Validation,2020
Disprz,2015,Chennai,Education And Learning,"Disprz is a one-of-its-kind “knowledge-tech” start-up that strives to make people knowledgeable, productive and smarter at what they do.","Kuljit Chadha, Subramanian Viswanathan","Xseed Partners, InnoVen Capital",1600000.0,Early Traction,2020
Credit Wise Capital,1994,Mumbai,Finance And Technology,CreditWise Capital is a consumer finance company.,"Hirak Joshi, Aalesh Avlani",Venture Catalysts,6000000.0,Validation,2020
Winuall,2019,Bangalore,Education And Learning,"Winuall specializes in the fields of E-learning, online quizzes, and tests, study material for competitive exams.","Ashwini Purohit, MS Chouhan","Amit Lakhotia, Akash Gehani",2000000.0,Debt,2020
Genrobotics,2015,Trivandrum,Technology And Software,GenRobotic specializes in powered robotic exoskeletons with RC controlled humanoid robotic systems and Artificial Intelligence.,"Arun George, Nikhil NP, Rashid Bin Abdulla, Vimal Govind MK",Unicorn India Ventures,300000.0,Debt,2020
Livve,2015,Cochin,Real Estate And Housing,An online platform where both owners and tenants find help in making sure their rental transaction are safe and secure.,Maya Lakshman,Not filled,1500000.0,Validation,2020
Ergos,2012,Samastipur,Agriculture And Technology,Ergos is building an integrated supply chain by setting up micro warehouses.,"Kishor Kumar Jha, Praveen Kumar","Aavishkaar Venture Capital, Chiratae Ventures",5000000.0,Early Traction,2020
Krishitantra,2017,Hyderabad,Agriculture And Technology,Krishi-Tantra is an Agri-IoT startup building farm automation for controlled agricultural environment.,"Sandeep Kondaji, Vishnuprasada Bhat, Anand Bellan Raman","NABVENTURES, Omnivore",1000000.0,Validation,2020
PakkaProfile,2019,Bangalore,Technology And Software,"PakkaProfile bridges the gap between companies and the workforce by making better, unbiased decisions with the help of psychometric games","Nagmanjunath Shivakumar, Savio Sebastian",Java Capital,4000000.0,Validation,2020
Unocoin,2013,Tumkur,Finance And Technology,"Unocoin is an Indian bitcoin processor that enables users to buy, sell, store, use, and accept bitcoins.","Abhinand Kaseti, Harish B V, Sathvik Vishwanath, Sunny Ray","Digital Finance Group, FundersClub",4000000.0,Early Traction,2020
Pesto,2017,New Delhi,Education And Learning,Pesto is a career accelerator for software engineers with the mission to take opportunities to places where talent exists.,"Andrew Linfoot, Ayush Jaiswal","Sriharsha Majety, Rahul Jaimini",4000000.0,Debt,2020
NirogStreet,2016,Gurugram,Healthcare And Health Technology,NirogStreet is an Ayurvedic doctor discovery and appointment booking platform where patients can easily find doctors and fix consultation.,Ram N Kumar,"Wavemaker Partners, Subho Ray",2000000.0,Validation,2020
Bambrew,2018,Bangalore,Technology And Software,Bambrew is an online shop for reusable bamboo straws.,Vaibhav Anant,Upsparks,4000000.0,Ideation,2020
Treebo Hotels,2015,Bangalore,Consumer Goods And Services,"Treebo is India's tech-enabled, asset-light affordable accommodation brand.","Kadam Jeet Jain, Rahul Chaudhary, Sidharth Gupta","Ramesh Mangaleswaran, Saikiran Krishnamurthy",6000000.0,Debt,2020
GPS Renewables,2010,Bangalore,Energy And Environment,To solve the urban waste problem by utilising local technologies and business models.,"Mainak, Sreekrishna","Triodos, Caspian",3000000.0,Early Traction,2020
