Company_Brand,Founded,HeadQuarter,Sector,What_it_does,Founders,Investor,Amount,Stage,Year
Teachmint,2020.0,Bangalore,Edtech,Teachmint is an easy to use platform for tutors to conduct unlimited live classes and manage their classrooms,"Mihir, Payoj Jain, Divyansh Bordia, Anshuman Kumar",Lightspeed India,3500000.0,Seed,2020
Peel-Works,2010.0,Mumbai,E-Commerce,Peel-Works is a tech and data analytics company specializing in e-commerce for corner stores.,"Sachin Chhabra, Nidhi Ramachandran","CESC Ventures, Brun Raschle",3000000.0,Venture - Series Unknown,2020
Janani,2020.0,Bangalore,Fertility Tech,Janani aims to make the process of infertility treatment and assisted fertilisation easier,Nilay Mehrotra,9Unicorns,200000.0,Pre-Seed,2020
Credgenics,2018.0,Gurugram,Finance,"Credgenics is a tech-enabled platform backed by Titan Capital, helping fintech lenders and Banks in their critical NPA reduction",Nirmit Parikh,"Accel, Sunder Nookala",3300000.0,Seed,2020
Finelistings,2015.0,New Delhi,Luxury Car Startup,A Used Luxury Car Marketplace,Aneesh Mathur,Justdial,4000000.0,Series E,2020
Wellversed,2018.0,New Delhi,Healthcare,Wellversed Health enables production of customised clinical food products specific to health requirements of a demography or an individual.,Kshama Fernandes,Inflection Point Ventures,4000000.0,Venture - Series Unknown,2020
Nykaa,2012.0,Mumbai,Cosmetics,Nykaa is an online marketplace for different beauty and wellness products.,Falguni Nayar,"Alia Bhatt, Katrina Kaif",4000000.0,Seed Funding,2020
Jumbotail,2015.0,Bangalore,E-Commerce,"Jumbotail is solving an important problem of organising food and grocery ecosystem in India through technology, data science and design.","Ashish Jhina, Karthik Venkateswaran",Nexus Venture Partners and 23 High Networth Individuals (HNIs),11000000.0,Series B+,2020
Winzo,2018.0,New Delhi,Gaming Startup,WinZO is a mobile e-sports social gaming platform that offers monetary benefits and prizes to players.,"Ashish Singhal, Govind Soni, Vimal Sagar Tiwari","Makers Fund, Courtside Ventures",2000000.0,Debt Financing,2020
mCaffeine,2015.0,Mumbai,Cosmetics,"MCaffeine is a personal care brand that offers caffein-infused face, body, and hair care products.","Tarun Sharma, Vikas Lachhwani","RPSG Ventures, Amicus Capital",5000000.0,Series B,2020
Pocket FM,2018.0,Bangalore,Fm,Pocket FM is an audiobook & podcast app that brings you over 10K+ popular audiobooks.,Rohan Nayak,"Times Group, Lightspeed",5000000.0,Series A,2020
Snackible,2015.0,Mumbai,Healthcare,Snackible operates a health-food production company designed to sell healthy snack food via online and offline channels.,Nitish Mittersain,"Mumbai Angels, Murali Nair",4000000.0,Bridge,2020
FreshtoHome,2015.0,Bangalore,E-Commerce,Freshtohome is an e-commerce platform for fresh and chemical-free seafood.,Shan Kadavil,"Ascent Capital, Iron Pillar",16000000.0,Series G,2020
Jumbotail,2015.0,Bangalore,Retail,Jumbotail is solving an important problem of organising food and grocery ecosystem in India,"Ashish Jhina, Karthik Venkateswaran","Nexus Venture Partners, Capria Ventures",11000000.0,Debt Financing,2020
Nykaa,2012.0,Mumbai,E-Commerce,Nykaa is an online marketplace for different beauty and wellness products.,Falguni Nayar,"Katrina Kaif, Steadview Capital",4000000.0,Series E,2020
TagZ Foods,2019.0,Bangalore,Food,TagZ Foods is a supplier of snacks and food products.,"Sagar Bhalotia, Anish Basu Roy","Exfinity Venture Partners, Shesh Kondi",4000000.0,Fresh Funding,2020
Genius Teacher,2016.0,Mumbai,Edtech,"Genius Teacher creates engaging educational content, delivers fun learning experience to the students","Advitiya Sharma, Gaurav Lahoti","Sandeep Tandon, Daniel Lapus",2000000.0,Series C,2020
Krimanshi Feeds,2015.0,Jodhpur,Nutrition Sector,Krimanshi aims to increase rural income by improving the productivity of Indian cattle with better quality feed.,Nikhil Bohra,"Rajasthan Venture Capital Fund, AIM Smart City",500000.0,Series F,2020
Origo,2010.0,Gurugram,Agritech,Provider of marketing and warehousing services for agricultural commodities.,"Sunoor Kaul,",Northern Arc Capital,4000000.0,Pre-Seed,2020
GetVantage,2019.0,Mumbai,Finance,GetVantage is India and Southeast Asia's first fintech enabled Revenue-based financing platform.,"Amit Srivastava, Bhavik Vasa, Sachin Tagra, Sachin Tagra","Samyakth Capital, Venture Catalysts",5000000.0,Seed,2020
Betterplace,2015.0,Bangalore,Tech Platform,Developer of a digital verification platform designed to manage the semi-formal workforce.,"Saurabh Tandan, Pravin Agarwala",Jungle Ventures,10000000.0,Series B,2020
Biddano,2016.0,Mumbai,Healthcare,India's 1st tech-enabled healthcare logistics platform.,Talha Shaikh,Windrose Capital,600000.0,Series E,2020
InVideo,2017.0,Mumbai,Video,InVideo enables you to transform your content into great videos.,"Harsh Vakharia, Pankit Chheda, Sanket Shah","Base Partners, Sequoia Capital India",15000000.0,Series A,2020
Arzooo,2016.0,Bangalore,Retail Tech,"Retail tech platform empowering 300,000+ small retailers in electronics space to compete with big organised players and increase sales","Khushnud Khan, Rishi Raj Rathore","3Lines, Jabbar Internet Group",7500000.0,Series A,2020
Hubilo,2020.0,"San Francisco, California, United States",Tech Company,World’s smartest virtual event platform that brings Experience & Intelligence together,"Mayank Agarwal, Vaibhav Jain","Nishant Rao, Jonathan Boutelle",4500000.0,Seed,2020
BASIC Home Loan,2020.0,Gurugram,Finance,"A platform for automating home loans for middle and low-income households in India,",Atul Monga,Picus Capital,5000000.0,Seed,2020
Ketos,2015.0,"San Francisco, United States",Ai Startup,KETOS provides hardware and software analytics solutions and real-time data for usage and flow across water systems.,Meena Sankaran,"Citi Ventures, Illuminated Funds Group",18000000.0,Series B+,2020
SUGAR cosmetics,2012.0,Mumbai,Cosmetics,It is a cruelty-free makeup brand providing cosmetics that is high on style and higher on performance.,"Kasuhik Mukherjee, Vineeta Singh","A91 Partners, RB Investments Pte. Ltd",2000000.0,Series G,2020
Signzy,2015.0,Bangalore,Finance,It is creating 'building blocks for a Digital Trust system.,"Ankit Ratan, Ankur Pandey, Arpit Ratan","GenNext Ventures, Contrarian Drishti Partners",5400000.0,Early Seed,2020
Ahaguru,2012.0,Chennai,Edtech,"It is conducting IIT JEE Coach for Physics, Math and Chemistry easily.","Gomathi S, Dr Balaji Sampath",We Founder Circle,4000000.0,Series A,2020
Tekion,2016.0,"San Ramon, California",Ai Startup,It is a cloud-built platform with advanced machine learning and AI capabilities for a personalized and seamless consumer experience.,"Guru Sankararaman, Jay Vijayan","Alliance Ventures, Storm Ventures",150000000.0,Series C,2020
Brighteye Ventures,2017.0,"Paris, Ile-de-France, France",Edtech,Education technology venture capital firm.,David guerin,Tandem,5400000.0,Series G,2020
EzeRx,2018.0,Kolkata,Medtech,Developer and manufacturer of medical devices,"Amit mandahar, Chaitali roy","Indian Oil Corporation, Krishna Chakravarty",200000.0,Seed,2020
VitalTech,2018.0,"Plano, Texas, United States",Heathtech,"VitalTech is a develop technologies that empower patients to better care for their safety,",Anjan Panneer Selvam,Tech Mahindra,3000000.0,Seed,2020
Genius Teacher,2016.0,Mumbai,Edtech,"Genius Teacher creates engaging educational content, delivers fun learning experience to the students","Advitiya Sharma, Gaurav Lahoti","Whiteboard Capital, VKG Ventures LLP.",2000000.0,Series D,2020
Ultraviolette Automotive,2014.0,Bangalore,Automobiles,Ultraviolette Automotive is a technology startup working on electric two-wheelers and energy infrastructure.,"Narayan Subramaniam, Niraj Rajmohan",TVS Motor Company,4000000.0,Series B,2020
Tring,2019.0,Mumbai,Social Media,"Tring is a celebrity engagement platform, for all occasions including birthday, anniversaries, get well soon messages.","Akshay Saini, Rahul Saini, Pranav Chabhadia","Sujeet Kumar, Hemesh Singh",4000000.0,Seed Funding,2020
Rare Planet,2015.0,Kolkata,Retail Startup,Rare Planet sells handicrafts made by local artisans.,"Ranodeep Saha, Vijay Kumar",Venture Catalysts,400000.0,Series I,2020
GoodGamer,2020.0,Bangalore,Gaming,GoodGamer is India's first Daily Fantasy Sports and true Esports gaming platform.,Charles Creighton,Alteria Capital,2500000.0,Seed,2020
InnAccel,2012.0,Bangalore,Medtech,"A building a portfolio of novel medical devices designed, engineered, and priced for global Emerging Markets.",Sahil Barua,Mount Judi Ventures,1500000.0,Series B,2020
Tiliter,2017.0,Sydney,Retail,Software that uses computer vision to recognise products without barcodes,"Chris Sampson, Marcel Herz, Martin Karafilis","AngelList, Investec",7500000.0,Early Seed,2020
Slintel,2016.0,"San Francisco Bay Area, Silicon Valley, West Coast",Sles And Marketing,"Slintel, a leader in capturing technographics-powered buying intent, helps companies uncover the 3% of active buyers in their target market.","Deepak Anchala, Rahul Bhattacharya, Ranjana TN","Accel, Stellaris Venture Partners",4200000.0,Series A,2020
SoOLEGAL,2015.0,New Delhi,Legaltech,"SoOLEGAL is a global integrated directory of lawyers, legal aid organizations, and Law firms.",Manish Kaul,"Venture Catalysts, 9Unicorns Accelerator Fund",4000000.0,Seed Round,2020
HobSpace,2019.0,Mumbai,Edtech,India's Activity Hub for Kids,"Priya Goel Sheth, Harsh Jain",Artha Venture,200000.0,Seed,2020
Supplynote,2015.0,Noida,Saas Startup,Supplynote is India's leading procurement platform with a unique stack of SAAS and E-commerce to solve the procurement problem,"Abhishek Verma, Harshit Mittal, Kumar Kushang, Nitin Prakash","MOX, SOSV",500000.0,Seed,2020
Hire Me Car,2015.0,Noida,Car Service,India's largest cloud based digital discovery and services provisioning platform for the taxi rental,Pankaj Sharma,Tiger Global,4000000.0,Seed,2020
ShopUp,2017.0,Bangaldesh,E-Commerce,"ShopUp provides easy access to B2B sourcing, last-mile logistics, digital credit, and business management solutions to small businesses.","Afeef Zaman, Ataur Rahim Chowdhury, Siffat Sarwar","Flourish Ventures, Lonsdale Capital",22000000.0,Series A,2020
Harmonizer India,2019.0,Bangalore,Tech Startup,"Energy-efficient solutions based on the Artificial Intelligence, Machine Learning and Internet of Things technology,",M R Srinivas,Kapil Dev,4000000.0,Early Seed,2020
Zomato,2008.0,Gurugram,Foodtech,Zomato is a food delivery and restaurant discovery site that provides information and reviews about restaurants.,"Deepinder Goyal, Gaurav Gupta, Pankaj Chaddah","Kora, Tiger Global Management",52000000.0,Early Seed,2020
Dukaan,2020.0,Mumbai,Tech Startup,Developer of an android application designed for businesses to sell online.,"Subhash Choudhary, Suumit Shah","Lightspeed, Matrix Partners.",6000000.0,Seed,2020
CredR,2014.0,Mumbai,Bike Marketplace,India’s Only 100% Inspected and Certified Used Bikes Marketplace.,"Nikhil Jain, Nittin Mittal, Sumit Chhazed","Eight Roads Ventures, On Mauritius",2000000.0,Series B,2020
Satyukt,2018.0,Bangalore,Agri Tech,An agritech company that provides business to business (B2B) agricultural data,"Sat Tomer, Yukti Gill","NABVENTURES, Social Alpha (India)",500000.0,Seed,2020
RACEnergy,2018.0,Hyderabad,Automobiles,RACEnergy builds and deploys battery swapping infrastructure for use in various segments of vehicles.,"Arun Sreyas, Gautham Maheswaran","growX Ventures, Huddle (Incubator)",4000000.0,Series B,2020
TREAD,2020.0,Bangalore,Fitness Startup,A homegrown fitness startup that aims to advance the 'Fit India' initiative by offering holistic and affordable workouts.,Dinesh Godara,"Better Capital, Kunal Shah, Gaurav Munjal",1100000.0,Venture - Series Unknown,2020
Anveshan,2019.0,Bangalore,Foodtech,Provide quality and healthy food products,"Aayushi Khandelwal, Akhil Kansal, Kuldeep Parewa",Titan Capital,100000.0,Seed Round,2020
TeaMonk,2016.0,Bangalore,Food & Bevarages,India's Finest Specialty Tea company.,"Amit Dutta, Ashok Mittal","Lead Angels Network, Roots Ventures",900000.0,Series E,2020
Fleetx,2017.0,Gurugram,Tech Startup,"Fleetx is an intelligent data platform which uses AI, machine learning, sensors and predictive analytics to help fleet owners.","Abhay Jeet Gupta, Parveen Kataria, Udbhav Rai, Vineet Sharma, Vishal Mishra","Rohit Bansal, Rohan Ranavat",3000000.0,Pre-Seed,2020
ReNEWate,2018.0,Pune,Real Estate,"Tech platform helping millions of renovation contractors, property improvement professionals and businesses manage their business digitally.",Supratik Ghatak,Real Estate Accelerator Program,4000000.0,Series B+,2020
Tango Eye,2018.0,Chennai,Saas Startup,Retail Video Analytics SaaS product,Surender Gounder,"Riso Investments, Lenskart",4000000.0,Seed,2020
Rare Planet,2015.0,Kolkata,Reatil Startup,Rare Planet sells handicrafts made by local artisans.,"Ranodeep Saha, Vijay Kumar",Venture Catalysts,4000000.0,Series E,2020
Avataa Me,2014.0,Bangalore,Ar Platform,AVATAAR.ME is a deep-tech 3D AR platform which delivers personalized fashion discovery experience to users on mobile devices.,Gaurav Baid,Sequoia Capital India,7000000.0,Series A,2020
Arrival,2015.0,"London, England, United Kingdom",Ev Startup,Arrival is a technology company that specializes in developing electric vehicles.,Denis Sverdlov,"UPS Ventures, Hyundai Motor Company",118000000.0,Early Seed,2020
Cover Genius,2014.0,"Sydney, New South Wales, Australia",Finance,Cover Genius provides an insurance distribution platform designed to protect the customers of e-commerce companies,"Angus McDonald, Chris Bayley","King River Capital, Leap Capital",15000000.0,Series E,2020
Phononic Vibes,2018.0,"Milano, Lombardia, Italy",Deeptech,"Phononic Vibes introduces a new patented technology for vibration and noise control and isolation, with a circular economy approach.","Andrea Boeri, Braghin Francesco, Giovanni Capellari, Luca D'Alessandro, Stefano Caverni",Elevation Capital,2300000.0,Series A,2020
MikeLegal,2017.0,Gurugram,Legaltech,MikeLegal is an AI powered legal associate that aims to build an ecosystem of legal tools,"Tushar Bhargava, Anshul Gupta","SOSV, Artesian",4000000.0,Seed,2020
Clair,2019.0,"New York, United States",Finance,Clair is a social fintech that provides Instant Pay Access as a Service for human capital management and gig platforms.,"Alex Kostecki, Erich Nussbaumer, Nico Simko","Upfront Ventures, Walkabout Ventures",4500000.0,Seed,2020
Gourmet Garden,1999.0,"Palmwoods, Queensland, Australia",Consumer Goods,Gourmet Garden is a global market leader in chilled convenient packaged herbs.,Arjun Balaji,Advent Partners,4000000.0,Series C,2020
Miko,2015.0,Mumbai,Ai Startup,"Miko is an advanced robotics startup founded by three IIT Bombay post-graduates on the pillars of robotics, AI & IoT.","Chintan Raikar, Prashant Iyengar, Sneh Vaswani","Stride Ventures, YourNest Venture Capital",3000000.0,Series D,2020
Razorpay,2014.0,Bangalore,Finance,"Razorpay is a platform that enables businesses to accept, process, and disburse payments.","Harshil Mathur, Shashank Kumar","Tiger Global Management, Sequoia Capital India",100000000.0,Series D,2020
Ninjacart,2015.0,Bangalore,Food Industry,"Ninjacart is a business-to-business fresh produce supply chain that connects farmers, manufactures, and brands to retailers directly.","Ashutosh Vikram, Kartheeswaran K K, Sharath Loganathan, Thiru Nagarajan, Thirukumaran Nagarajan, Vasu Devan","Syngenta Ventures, Walmart",30000000.0,Series C,2020
Wow! Momo,2008.0,Kolkata,Food Industry,Wow! Momo is a chain of fast-food restaurants that specializes in momos.,"Binod Kumar Homagai, Sagar Daryani, Shah Miftaur Rahman","Tiger Global Management, William Bissell",5000000.0,Pre-Seed,2020
Pepper Content,2017.0,Mumbai,Content Marketplace,Pepper Content is a Content-Mediation Platform that connects talented writers to organisations that require content.,"Anirudh Singla, Rishabh Shekhar","Venture Catalysts, 9Unicorns Accelerator Fund",4200000.0,Series A,2020
LIVSPACE,2014.0,Bangalore,Interior Design,"Livspace is an interior design startup that offers a platform that connects people to designers, services, and products.","Anuj Srivastava, Ramakant Sharma, Shagufta Anurag","Mercer Investments, Bessemer Venture Partners",4000000.0,Series F,2020
Acculi Labs,2017.0,Bangalore,Healthcare,Acculi Labs is a clinical grade smartphone based diagnostic tool,"HariPrasath M., Rupam Das",Startup Basket.,600000.0,Seed,2020
Your MD,2012.0,"London, England, United Kingdom",Healthcare,Your.MD is a platform committed to helping a billion people find their health by unlocking self-care with digital technology.,"Alessandro Traverso, Birger Lie, Harald Jellum, Matteo Berlucchi","Orkla Ventures, Smedvig Capital",25000000.0,Series D,2020
Antaios,2016.0,France,Tech Company,Developer of memory-based technology intended to solve issues of advanced computing.,Jean Pierre Nozieres,Anicut Angel Fund,11000000.0,Seed Funding,2020
Unnati,2017.0,Noida,Agritech,A helping hand to the farming community through Artificial Intelligence,"Amit Sinha, Ashok Prasad",NABVENTURES,1700000.0,Debt Financing,2020
Disprz,2015.0,Chennai,Edtech,"Disprz is a one-of-its-kind “knowledge-tech” start-up that strives to make people knowledgeable, productive and smarter at what they do.","Kuljit Chadha, Subramanian Viswanathan","Xseed Partners, InnoVen Capital",1600000.0,Bridge,2020
Uni,2015.0,Mumbai,Finance,The team aims to bridge the gap for credit cards and make them more accessible for people across different regions.,Nitin Gupta,"Lightspeed India Partners, Accel India",18500000.0,Seed,2020
Credit Wise Capital,1994.0,Mumbai,Finance,CreditWise Capital is a consumer finance company.,"Hirak Joshi, Aalesh Avlani",Venture Catalysts,6000000.0,Seed,2020
Chargebee,2011.0,"San Francisco Bay Area, West Coast, Western US",Saas Startup,Chargebee is a PCI Level 1 certified subscription and recurring billing system for SaaS and subscription based eCommerce businesses,"Sai Srinivas Kiran G, Shubham Malhotra","Accel, Steadview Capital",55000000.0,Series F,2020
Reliance Retail Ventures Ltd,2006.0,Mumbai,Retail,"Reliance Retail offers online shopping and a chain of neighborhood stores, supermarkets, and wholesale/specialty stores.",Mukesh Ambani,"Silver Lake, Mubadala Investment Company",70000000000.0,Seed Funding,2020
Winuall,2019.0,Bangalore,Edtech,"Winuall specializes in the fields of E-learning, online quizzes, and tests, study material for competitive exams.","Ashwini Purohit, MS Chouhan","Amit Lakhotia, Akash Gehani",2000000.0,Series B,2020
Genrobotics,2015.0,"Trivandrum, Kerala, India",Ai Startup,GenRobotic specializes in powered robotic exoskeletons with RC controlled humanoid robotic systems and Artificial Intelligence.,"Arun George, Nikhil NP, Rashid Bin Abdulla, Vimal Govind MK",Unicorn India Ventures,300000.0,Series E,2020
Livve,2015.0,Cochin,Rental Space,An online platform where both owners and tenants find help in making sure their rental transaction are safe and secure.,Maya Lakshman,Y Combinator,1500000.0,Seed,2020
Ergos,2012.0,"Samastipur, Bihar",Agritech,Ergos is building an integrated supply chain by setting up micro warehouses.,"Kishor Kumar Jha, Praveen Kumar","Aavishkaar Venture Capital, Chiratae Ventures",5000000.0,Series A,2020
Krishitantra,2017.0,Hyderabad,Soil-Tech,Krishi-Tantra is an Agri-IoT startup building farm automation for controlled agricultural environment.,Saurabh Saxena,"NABVENTURES, Omnivore",1000000.0,Seed,2020
PakkaProfile,2019.0,Bangalore,Recruitment Startup,"PakkaProfile bridges the gap between companies and the workforce by making better, unbiased decisions with the help of psychometric games","Nagmanjunath Shivakumar, Savio Sebastian",Java Capital,4000000.0,Seed,2020
Monet Networks,2014.0,"Irvine, California, United States",Ai Startup,Monet Networks Using sentiment and non verbal cues analysis for increased engagement and real time content feedback.,Anurag Bist,"SenseAI Ventures, EvoNexus",500000.0,Bridge,2020
Unocoin,2013.0,"Tumkur, Karnataka",Finance,"Unocoin is an Indian bitcoin processor that enables users to buy, sell, store, use, and accept bitcoins.",Sahil Barua,Y Combinator,4000000.0,Series A,2020
Pesto,2017.0,New Delhi,Edtech,Pesto is a career accelerator for software engineers with the mission to take opportunities to places where talent exists.,"Andrew Linfoot, Ayush Jaiswal","Sriharsha Majety, Rahul Jaimini",4000000.0,Fresh Funding,2020
NirogStreet,2016.0,Gurugram,Ayurveda Tech,NirogStreet is an Ayurvedic doctor discovery and appointment booking platform where patients can easily find doctors and fix consultation.,Ram N Kumar,"Wavemaker Partners, Subho Ray",2000000.0,Series A+,2020
Bambrew,2018.0,Bangalore,Packaging Solution Startup,Bambrew is an online shop for reusable bamboo straws.,Saurabh Saxena,Upsparks,4000000.0,Series A+,2020
Omnify,2016.0,"San Francisco Bay Area, Silicon Valley, West Coast",Saas Startup,Omnify is a Global SaaS platform for Small Services Business,"Kabandi Saika, Manik Mehta","Saurabh Arora, LD Sharma",4000000.0,Series B,2020
Fanball XI,2016.0,New Delhi,Gaming,The gaming company mostly focused on fantasy football games,Vinayak Seth,Foxhog Ventures,1000000.0,Seed,2020
Treebo Hotels,2015.0,Bangalore,Hospitality,"Treebo is India's tech-enabled, asset-light affordable accommodation brand.","Kadam Jeet Jain, Rahul Chaudhary, Sidharth Gupta","Ramesh Mangaleswaran, Saikiran Krishnamurthy",6000000.0,Pre-Seed,2020
GPS Renewables,2010.0,Bangalore,Cleantech,To solve the urban waste problem by utilising local technologies and business models.,"Mainak, Sreekrishna","Triodos, Caspian",3000000.0,Series A,2020
Public,2019.0,New Delhi,Social Media,Video-led social app Public provides users with a platform to share and view important hyperlocal videos,Azhar Iqubal,"Lee Fixel's Addition, SIG Global, Tanglin Venture Partners",30000000.0,Seed Round,2020
Legal Salah,2015.0,Kolkata,Legaltech,Legal Salah is bringing the provision of imparting value based legal and consultancy services to the user.,CA Abhinit Singh,I2I Capitals,1000000.0,Seed,2020
FanPlay,2018.0,New Delhi,Gaming,FanPlay Technologies operates as a real-money gaming startup.,"Bharat Gupta, Pritesh Kumar","Core91 Fund, Anupam Mittal",4000000.0,Seed,2020
ECOSTP,2017.0,Bangalore,Sanitation Solutions,Eco friendly zero power zero maintenance sewage treatment plant in India.,"Simar Kohli, Tharun Kumar, Praseed KK",Terwilliger Centre,19000000.0,Series B,2020
Coralogix,2013.0,"San Francisco, California, United States",Saas Startup,Coralogix is a log analytics SaaS platform that improves the delivery and maintenance process for software providers.,"Ariel Assaraf, Guy Kroupp, Lior Redlus, Yoni Farin","2B Angels, Janvest Capital Partners",25000000.0,Series B,2020
Equiwatt,2015.0,"Newcastle Upon Tyne, Newcastle upon Tyne, United Kingdom",Tech Company,Equiwatt is a digital platform enabling households to get paid for saving energy at peak times.,Prabhkiran Singh,Rising Stars,300000.0,Series G,2020
Reliance Retail Ventures,2006.0,Mumbai,E-Commerce,"Reliance Retail offers online shopping and a chain of neighborhood stores, supermarkets, and wholesale/specialty stores.",Mukesh Ambani,"General Atlantic, Kohlberg Kravis Roberts",800000000.0,Series B,2020
Zhangmen,2005.0,"Shanghai, China",Edtech,Zhangmen is an online tutoring platform provides tutoring courses to students.,Yi Zhang,"CICC Alpha, VMS Asset Management",400000000.0,Series C,2020
AgroWave,2017.0,Gurugram,Agritech,Agrowave engages in transforming agriculture supply chain by connecting farms to businesses.,Anu Meena,Sekhar Puli,500000.0,Bridge,2020
Sapio Analytics,2018.0,Mumbai,Tech Company,Sapio Analytics provides AI-powered policymaking solutions for government institutions.,"Ashwin Srivastava, Hardik Somani",Alteria Capital,150000.0,Debt Financing,2020
Taimei,2013.0,"Jiaxing, Zhejiang, China",Healthcare,Taimei Technology provides a cloud platform for clinical research collaboration.,Lu Zhao,"Cowin Venture, ZSVC",176000000.0,Debt Financing,2020
Avanse Financial Services,2012.0,Mumbai,Finance,"Avanse, regulated by the Reserve Bank of India, is an education finance company that operates as a non-banking finance company (NBFC).",Amit Gainda,Y Combinator,15000000.0,Series A,2020
Industry Buying,2013.0,New Delhi,E-Commerce,India's largest industrial ecommerce platform,"Rahul Gupta, Swati Gupta","BlackSoil, BEENEXT",15000000.0,Series A+,2020
Hopscotch,2011.0,Mumbai,E-Commerce,"Hopscotch provides an insider access to international brands for babies, kids, and moms.",Utham Gowda,"Marc Lore, Rise Capital",25000000.0,Series A+,2020
Pristyn Care,2018.0,Gurugram,Healthcare,Pristyn Care is Health Care Startup that is disrupting Day Care Procedures.,Harsimarbir (Harsh) Singh,"Sequoia Capital India, Hummingbird Ventures",11000000.0,Series D,2020
WoodenStreet,2015.0,Rajastan,Home Design,Wooden Street is a online furniture platform that provides custom made & ready to order furniture.,"Dinesh Pratap, Lokendra Ranawat, Vikas Baheti, Virendra Ranawat","IAN Fund, Rajasthan Venture Capital Fund",1000000.0,Series E,2020
ACKO,2016.0,Mumbai,Insuretech,Acko General Insurance is a private sector general insurance company in India.,"Ruchi Deepak, Varun Dua","RPS Ventures, Intact Ventures",60000000.0,Series G,2020
Farmers Fresh Zone,2015.0,Kochi,Agritech,FarmersFZ is an online venture for fresh and safe vegetables and agri products.,Pradeep PS,"Artha India Ventures, Nagaraja Prakasam",470000.0,Series H,2020
Invento,2016.0,Bangalore,Ai Startup,Invento Robotics specializes in developing service robots intended for customer interactions.,Kajal Ilmi,"Chiripal Group, Ratish Kumar Nair",4000000.0,Series D,2020
Infurnia,2014.0,Bangalore,Tech Startup,Infurnia Technologies is an eponymous cloud-based architecture design software platform.,"Lovepreet Mann, Nikhil Kumar, Parul Jain","Pallav Nadhani, Idein Ventures",240000.0,Series A,2020
