Company_Brand,Founded,HeadQuarter,Sector,What_it_does,Founders,Investor,Amount,Stage,Year
KiranaKart,2020,Mumbai,E-Commerce And Retail,A better model for instant grocery delivery in India.,"Kaivalya Vohra, Aadit Palicha",Global Founders Capital,720000.0,Ideation,2021
Meddo,2018,Gurgaon,Healthcare And Health Technology,Meddo is an end-to-end medical services provider,Saurabh Kochhar,"growX ventures, Venture Gurukool",3000000.0,Validation,2021
SP Robotic Works,2012,Chennai,Education And Learning,An innovative place to explore next-generation technologies for students and all tech enthusiasts.,"Sneha Priya, Pranavan S",Mount Judi India Growth Fund,3000000.0,Early Traction,2021
3SC,2018,Gurugram,Transport And Logistics,An end-to-end supply chain analytics company that provides execution and analytics solutions which are comprehensive and customized.,"Lalit, Sarita Das",GEF Capital’s South Asia Fund,15000000.0,Scaling,2021
Chai Waale,2018,Chennai,Consumer Goods And Services,"A wide range of exotic flavoured chai, in the most hygienic ambience at pocket-friendly prices.",Vidur Maheswari,"Sunil Sethia, Sunil Kumar Singhvi, Manish Mardia",600000.0,Debt,2021
Minimalist,2020,Jaipur,Consumer Goods And Services,Affordable skincare for all,"Mohit, Rahul Yadav",Sequoia Capital,10000000.0,Early Traction,2021
Biconomy,2019,New Delhi,Finance And Technology,Developer platform to enable a simplified transaction and onboarding experience for Web3 projects,"Aniket Jindal, Sachin Tomar","Mechanism Capital, DACM",9000000.0,Equity,2021
Fixcraft,2018,Gurugram,Automotive,India's Most Trusted Automotive Repair Brand,"Vivek Sharma, Abhishek Goyal, Inderjeet Rao",Not filled,1000000.0,Validation,2021
Slice,2016,Bangalore,Finance And Technology,"Slice is India's best credit card challenger to pay bills, manage expenses, and unlock rewards",Rajan Bajaj,"Northern Arc Capital, Niyogin Fintech Limited, Credit Saison India, Vivriti Capital",10000000.0,Equity,2021
90+ My Tuition App,2015,Bangalore,Education And Learning,Daskalos Virtual Academy Pvt Ltd is a company set up by a group of professionals who perform innovative work in management.,Vingish Vijay,Pearl Investment LLC,5000000.0,Early Traction,2021
Wasabi,2021,Bangalore,Human Resources And Consultancy,Help small businesses grow their sales via our customer interaction and growth platform.,"Pradeep Dodle, Nikhil Goenka","021 Capital, Sparrow Capital",1800000.0,Validation,2021
Strata,2019,Bangalore,Real Estate And Housing,Strata is an innovative tech-driven platform redefining Fractional Investments in Premium Commercial Real Estate,"Sudarshan Lodha, Priyanka Rathore","Kotak Investment Advisors Limited, Gruhas Proptech",6000000.0,Early Traction,2021
Ourbetterplanet,2020,Bangalore,E-Commerce And Retail,A curated online marketplace for all things sustainable!,Pallavi Srivastava,VANS Group,300000.0,Validation,2021
Murf.ai,2020,Bangalore,Technology And Software,"Murf AI is working on simplifying voice audio and making high-quality voice overs accessible to everyone, using artificial intelligence.","Sneha Roy, Ankur Edkie, Divyanshu Pandey",Elevation Capital,1500000.0,Validation,2021
JetSynthesys,2014,Pune,Media And Entertainment,"JetSynthesys is the group's most innovative company in the promising Digital and Technology Business World with a vision to create world class digital products, platforms and services in India",Rajan navani,Sachin Tendulkar,2000000.0,Debt,2021
MYFITNESS,2019,Silvassa,Technology And Software,"A new age D2C health & fitness brand with a mission to deliver products that taste good, feel good and do good.","Mohammad Patel, Rahil Virani",9Unicorns,1000000.0,Validation,2021
I am Love,2020,Mumbai,Healthcare And Health Technology,"I am Love came into existence in early 2020, with the aim of redefining the relationship we have with our health.",Shilpa Rathi,Xentel Investments,4000000.0,Validation,2021
MyGlamm,2015,Mumbai,E-Commerce And Retail,MyGlamm is India’s fastest growing direct-to-consumer beauty brand.,"Darpan Sanghvi, Priyanka Gill",Accel Partners,40000000.0,Equity,2021
Gumlet,2019,Bangalore,Technology And Software,Gumlet has built a new-age media delivery infrastructure that provides low code or no-code integration plugins that automate the entire media publishing pipeline.,"Divyesh Patel, Aditya Patadia",Sequoia’s Surge,1600000.0,Debt,2021
Eloelo,2015,Bangalore,Consumer Goods And Services,Creator-led Social Gaming & Live Streaming Platform,"Saurabh Pandey, Akshay Dubey","Waterbridge, Lumikai",2000000.0,Validation,2021
Edukemy,2020,Noida,Education And Learning,"Edukemy is the first EdTech company in the country, in the non –STEM segment, offering an immersive learning experience to the students, supported by cutting-edge technology and an AI-based evaluation system.",Chandrahas Panigrahi,"Auxano, Falcon5",2000000.0,Validation,2021
Zingbus,2019,Gurugram,Technology And Software,Zingbus is a renowned brand in the bus operating industry.,"Mratunjay, Prashant Kumar, Ravi Kumar Verma",Infoedge ventures,5000000.0,Validation,2021
NewsReach,2018,Ahmedabad,Media And Entertainment,NewsReach is a Mumbai based company that wants to create a disruptive ecosystem of original and local news content.,"Soniya Kundnani, Darshan Shah",JITO Angel Network,300000.0,Validation,2021
Pencilton,2017,Hyderabad,Finance And Technology,"India's first app for kids & teens to manage and spend pocket money while learning about money in a fun, gamified way.","VishwajitPureti, Ashish Singh, Pallavi Tipparaju, Viraj Gadde",Jupiter,330000.0,Ideation,2021
Bandhoo,2020,Gurugram,Technology And Software,"Bringing ease of eCommerce to Construction for builders, infrastructure companies, contractors and workers","Prashant Gupta, Sridhar Sundaram",Unitus Ventures,1000000.0,Debt,2021
ixigo,2007,Gurugram,Technology And Software,"AI-based travel app offering seamless planning and booking for flights, trains, buses, hotels and more!","Rajnish Kumar, Aloke Bajpai","GIC, Infoedge",53000000.0,Equity,2021
The Whole Truth,2019,Mumbai,Consumer Goods And Services,"Believe simple, homely ingredients, minimally processed, are the secret to nutritious, tasty food",Shashank Mehta,Sequoia Capital,6000000.0,Early Traction,2021
Insane AI,2021,Bangalore,Technology And Software,Mainstream fitness formats are a primitive solution to the modern problems of a sedentary lifestyle.,"Anurag Mundhada, Jayesh Hannurkar, Sourabh Agrawal",pi Ventures,800000.0,Validation,2021
Learn4o Technology,2020,Jaipur,Education And Learning,"Trying to solve the problem of unemployment in young graduates, who, despite having college degrees, don't have the skills for the real world.",Kamal Kant Gupta,IAN,4000000.0,Validation,2021
Droom,2014,Gurugram,Automotive,"Droom is an AI and data science driven online transactional platform, which offers 21st century experience in buying & selling used & new automobiles in India",Sandeep Aggarwal,Not filled,200000000.0,Scaling,2021
Skymet,2003,Noida,Energy And Environment,Provide services that allow clients to understand and organize themselves around changing environment.,Yogesh Patil,"Northern Arc, Caspian Impact Investments",1000000.0,Debt,2021
Go Swift,2019,Bangalore,Consumer Goods And Services,Help small & medium sized businesses to grow by helping them with their shipping requirements at the cheapest and most reliable service.,"Shyam Kalita, Debanshu Sinha, Prayas Mittal",Kalaari Capital,2000000.0,Validation,2021
Mamaearth,2016,Gurugram,Healthcare And Health Technology,A brand which develops products from world-class research and attempts to solve every little problem that we as parents face.,"Varun Alagh, Ghazal Alagh",Sofina Ventures SA,50000000.0,Equity,2021
G.O.A.T,2021,Bangalore,E-Commerce And Retail,G.O.A.T Brand Labs provides a tech-enabled platform for D2C brands to scale.,"Rishi Vasudev, Rameswar Misra","Tiger Global, Flipkart Ventures",36000000.0,Early Traction,2021
Keeros,2017,Lucknow,Consumer Goods And Services,"Keeros Roasted Supersnacks that are Healthy for All, Safe for Diabetics.","Sachin Sahni, Simran Sahni",Venture Catalysts,4000000.0,Validation,2021
ReDesyn,2016,Mumbai,Fashion And Apparel,"Merchandise drop-shipping platform for influencers, designers, creators & brands.","Smriti Dubey, Shikhar Vaidya",Anthill Ventures,300000.0,Validation,2021
Inspacco,2019,Pune,Technology And Software,"For residential commercial and industrial establishments , Inspacco is a one stop solution , that delivers affordable improvement and maintenance services","Sanket Nerkar, Paresh Kotkar",Not filled,200000.0,Debt,2021
Knorish,2016,Gurugram,Education And Learning,"Saas platform offers a feature packed platform enables businesses, experts, professionals, artists, instructors, specialists, coaches, people seeking work from home opportunities","Rakhi Wadhwa, Kinner N Sacchdev","Inflection Point Ventures, Rockstud Capital, Pentathlon Ventures, Prophetic Ventures syndicate",1000000.0,Validation,2021
Dozee,2015,Bangalore,Healthcare And Health Technology,"Dozee is India's only contactless health monitor that silently tracks your heart, respiration, sleep patterns, stress levels, cardiac contractions, apnea and more while you sleep.","Mudit Dandwate, Dandwate",Prime VP,5000000.0,Early Traction,2021
BlackBuck,2015,Bangalore,Transport And Logistics,BlackBuck marks the beginning of a new path in trucking. A path that is organized and makes trucking simple for every shipper and trucker.,"B Ramasubramanian, Chanakya Hridaya, Rajesh Yabaji","Tribe Capital, IFC Emerging Asia Fund, VEF",67000000.0,Scaling,2021
Mailmodo,2020,Bangalore,Marketing And Advertising,Mailmodo is a complete email marketing solution enabling users to create and send app-like interactive emails to improve email conversions.,"Aquibur Rahman, Apurv Gupta, Devyesh Tandon","Sequoia’s Surge, Y Combinator",2000000.0,Validation,2021
SuperBeings,2019,Bangalore,Technology And Software,"Continuous Leadership Development & Employee Engagement platform. Improve Leadership, Culture and Experience real-time.","Yasharth Mishra, Gaurav Bhawnani, Kunal Mishra",Endiya Partners,4000000.0,Validation,2021
NirogStreet,2018,New Delhi,Healthcare And Health Technology,Nirogstreet as a concept is working to make #Ayurveda first call of treatment.,Ram N Kumar,"Gokul Rajaram, Pureland Venture, Wavemaker Partners",2500000.0,Early Traction,2021
Hyreo,2016,Trivandrum,Human Resources And Consultancy,Hyreo stands for delivering a ‘customer-like’ experience for candidates throughout the recruiting process.,"Arun Satyan, Mahesh Raju, Sreenath N",Callapina Capital,4000000.0,Validation,2021
GODI Energy,2020,Hyderabad,Automotive,GODI is a technology innovation organization focused on the design and manufacturing of green energy storage solutions.,Mahesh Godi,Blue Ashva Capital,4000000.0,Debt,2021
Even,2020,Bangalore,Healthcare And Health Technology,One monthly subscription to cover all your healthcare needs.,"Mayank Banerjee, Matilde Giglio, Alessandro Davide Ialongo",Khosla Ventures,5000000.0,Validation,2021
Captain Fresh,2019,Bangalore,Transport And Logistics,A B2B marketplace leveraging technology to deliver the fastest harvest-to-retail in the industry.,Utham Gowda,"Accel Partners, Matrix India",12000000.0,Early Traction,2021
Otipy,2020,Gurugram,Consumer Goods And Services,Otipy helps the farmer to deliver farm fresh vegetables & fruits at doorstep.,Varun Khurana,"Omidyar Network India, Innoven Capital",10200000.0,Early Traction,2021
Lenskart,2008,Faridabad,Technology And Software,India's fastest growing eyewear company and largest eyewear company online.,Peyush Bansal,"Temasek, Falcon Edge",220000000.0,Scaling,2021
Eka.care,2020,Bangalore,Healthcare And Health Technology,A digitally enabled and connected healthcare ecosystem for better health outcomes.,Vikalp Sahni,"Deep Kalra, Ashish Kashyap, Rajesh Magow",4500000.0,Debt,2021
Braingroom,2015,Chennai,Education And Learning,"BrainGroom is an online marketplace for educational, recreational & wellness classes with defined target segment, quantifiable outcomes & specified time duration.","Madhula Sathyamoorthy, Naliene Ramasamy, Kalaiarsi Periasamy","IAN, Social Alpha, Startup Oasis",200000.0,Debt,2021
Edvizo,2017,Bangalore,Consumer Goods And Services,"Edvizo is an online marketplace to help students and parents find, compare and enroll in the best and trusted private institutes in their locality",Ravi Nishant,Inflection Point Ventures,1000000.0,Validation,2021
Credenc,2017,New Delhi,Finance And Technology,An education loan platform to finance meritorious students for the college expenses by underwriting future employability,Avinash Kumar,Capital India,25000000.0,Equity,2021
GlobalBees,2021,New Delhi,E-Commerce And Retail,Globalbees partners with entrepreneurs who have built an online-first business.  Our team scales up D2C businesses in India and abroad.,Nitin Agarwal,"FirstCry, Lightspeed Venture Partners",150000000.0,Early Traction,2021
Spinny,2015,Gurugram,Automotive,Spinny is a new age used car end-to-end platform in India.,"Niraj Singh, Mohit Gupta, Ramanshu Mahaur",Tiger Global,108000000.0,Scaling,2021
Mynvax,2017,Bangalore,Technology And Software,Mynvax is a pre-clinical stage vaccine biotechnology. Current develop programs include a recombinant vaccine for human influenza and COVID19.,"Dr Raghavan Varadarajan, Dr Gautham Nadig","Accel, LetsVenture, 1Crowd",4000000.0,Early Traction,2021
RiseBird,2018,Pune,Human Resources And Consultancy,RiseBird provides on-demand 2.5K + expert video interviews and A.I. powered insights to help companies hire online.,Ashutosh Seth,SAB Holdings,500000.0,Debt,2021
Uvi Health,2020,Bangalore,Healthcare And Health Technology,Digital health platform delivering personalized care for women’s sexual and reproductive health concerns,Mehak Malik,Titan Capital,330000.0,Ideation,2021
Vegrow,2020,Bangalore,Agriculture And Technology,Vegrow is in the business of fresh fruits & vegetables with addressable market size of $43 Billion.,"Praneeth Kumar, Shobhit Jain, Mrudhukar Batchu, Kiran Naik","Lightspeed Venture Partners, Elevation Capital",13000000.0,Equity,2021
Automovill,2015,Bangalore,Automotive,"Automovill is a unique platform to aggregate automobile service providers, where we connect vehicle owners with all kind of automobile service providers under one roof.","Mridu Mahendra Das, Chinmay Baruah",Mumbai Angels Network,500000.0,Debt,2021
NFTically,2021,Gurugram,Technology And Software,"NFT Marketplace to buy or sell NFT tokens in minutes or set up your own NFT store, website, a storefront in minutes.",Toshendra Sharma,Jayanti Kanani,4000000.0,Validation,2021
HealthifyMe,2012,Bangalore,Healthcare And Health Technology,HealthifyMe is a revolutionary health and fitness application that is on a mission to transform a billion lives!,"Tushar Vashisht, Sachin Shenoy","LeapFrog, Khosla Ventures",75000000.0,Scaling,2021
GalaxyCard,2017,Gurugram,Finance And Technology,GalaxyCard is a mobile based Instant Credit Card.,Amit Kumar,JITO Angel Network,450000.0,Debt,2021
Bella Vita Organic,2018,Gurugram,Healthcare And Health Technology,Bella Vita Organic or ‘The Good Life’ is dedicated to creating handcrafted and organic beauty solutions inspired by the natural elements of the earth and age old beauty best practices.,Aakash Anand,Ananta Capital,10000000.0,Equity,2021
SmartCoin,2016,Bangalore,Finance And Technology,India's Most Preferred Instant Loan App,"Jayant Upadhyay, Amit Chandel, Rohit Garg","Northern Arc, Vivriti Capital",10000000.0,Equity,2021
CareerNinja,2017,Mumbai,Education And Learning,"Careerninja Is A Funded, Early-stage Ed-tech Venture Building A Personalized Learning Platform To Help People Achieve Their Career Goals",Shronit Ladhaniai,Unitus Ventures,4000000.0,Validation,2021
MYSUN,2016,New Delhi,Energy And Environment,"India's Largest Online Rooftop Solar Platform for SMEs, Industries & Homes",Gagan Vermani,TATA Cleantech Capital,2000000.0,Debt,2021
Sea6 Energy,2010,Bangalore,Technology And Software,"Sea6 Energy envisions a future where the abundant oceans will be our biomass farms of tomorrow - to provide solutions in energy, agriculture and food.","Sailaja Nori, Nelson Vadassery, Sowmya Balendiran, Shrikumar Suryanarayan",Aqua-Spark,9000000.0,Scaling,2021
Beco,2018,Mumbai,Consumer Goods And Services,"Eco-friendly home and kitchen care products that are plastic-free, high in quality and affordable.","Aditya Ruia, Akshay Varma, Anuj Ruia",Climate Angels Fund,500000.0,Validation,2021
OneCode,2020,Bangalore,Technology And Software,"OneCode is a platform which connects new age digital first brands with ""relevant"" sellers (aka OneCoders) to sell their products and services","Manish Shara, Yash Desai","Sequoia’s Surge, Nexus Venture Partners",5000000.0,Debt,2021
MedPay,2020,Bangalore,Human Resources And Consultancy,MedPay® is building the real-time claims adjudication platform for health insurers.,"Arun Bhatia, Ravi Chandra","Entrepreneur First (EF), GrowX Ventures",1200000.0,Validation,2021
Inshorts,2013,Noida,Technology And Software,Built Inshorts with a promise to deliver news,Azhar Iqubal,Vy Capital,60000000.0,Equity,2021
Digantara,2018,Bangalore,Technology And Software,"Digantara is an Indian Space Technology Company incubated at Indian Institute of Science (IISc), establishing a space-based surveillance platform with global realtime earth coverage","Anirudh N Sharma, Rahul Rawat, Tanveer Ahmed",Kalaari Capital,2500000.0,Validation,2021
Aqgromalin,2018,Chennai,Agriculture And Technology,Aqgormalin is a tech driven farm diversification platform enabling farmers to diversify into Animal Husbandry and Aquaculture.,"Prasanna Manogaran, Bharani CL",Zephyr Peacock,700000.0,Validation,2021
Square Yards,2014,Gurugram,Real Estate And Housing,India’s largest tech enabled Real Estate Brokerage and Mortgage Marketplace,Tanuj Shori,ADM Capital,25000000.0,Equity,2021
OYO,2013,Gurugram,Consumer Goods And Services,OYO is a global platform that empowers entrepreneurs and small businesses with hotels and homes by providing full-stack technology,Ritesh Agarwal,"SoftBank Vision Fund, Hindustan Media Venture",660000000.0,Scaling,2021
Slang Labs,2017,Bangalore,Technology And Software,Slang Labs provides accurate and multilingual in-app voice assistants for Android and web apps,Kumar Rangarajan,100x Entrepreneurs,4000000.0,Debt,2021
NirogGyan,2019,Gurugram,Healthcare And Health Technology,"Simplifying Diagnostics for labs, doctors, and people.","Joyneel Acharya, Shweta Gandhi","Healthcare veterans, PIEDS",4000000.0,Validation,2021
Ola Electric,2017,Bangalore,Automotive,Ola Electric - The future of mobility is here.? Charging ahead to accelerate the world’s transition to sustainable mobility.,Bhavish Aggarwal,Bank of Baroda,100000000.0,Debt,2021
Bikry app,2019,Noida,Consumer Goods And Services,"Bikry, a Direct-to-Customer platform to start your online store within 30 seconds at 0% commission",Abhishek Bhayana,YCombinator,1300000.0,Debt,2021
Oliveboard,2012,Bangalore,Education And Learning,Oliveboard is the top exam preparation platform for Banking & Government Exams.,"Abhishek Patil, V Satish Kumar",IAN Fund,3000000.0,Debt,2021
Little Leap,2020,New Delhi,Education And Learning,Soft Skills that make Smart Leaders,Holistic Development Programs for children in age range 5-15,Vishal Gupta,300000.0,Debt,2021
Trell,2016,Bangalore,E-Commerce And Retail,India's Largest Lifestyle Social Commerce platform. Empowering millions of storytellers & Micro-Entrepreneurs.,"Pulkit Agarwal, Prashant Sachan, Arun Lodhi, Bimal Kartheek Rebba","Mirae Asset, H&M",45000000.0,Scaling,2021
Kredent,2008,Kolkata,Education And Learning,Kredent Academy is the unique concept where financial market professionals have taken the onus of creating a strong knowledge bank in their area of expertise,"Vineet Patawari, Vivek Bajaj, Vinay Pagaria",Kotak Securities,1000000.0,Debt,2021
EasyAspataal,2020,Mumbai,Healthcare And Health Technology,India’s First Digital Admission Desk for Hospitalisation.,"Manoj Gupta, Gunjali Kothari",Venture Catalysts,500000.0,Validation,2021
SMOOR,2008,Bangalore,Consumer Goods And Services,Instigate your sixth sense with our new range of chocolates.,Vimal Sharma,Klub,4000000.0,Debt,2021
Pankhuri,2019,Bangalore,Technology And Software,"Pankhuri is a women's only community for members to socialize, explore and upskill through live interactive courses, expert chat and interest-based clubs.",Pankhuri Shrivastava,Sequoia’s Surge,3200000.0,Debt,2021
Arcana,2019,Bangalore,Human Resources And Consultancy,Arcana is the Storage Layer of Ethereum.,"Mayur Relekar, Aravindh Kumar, Abhishek Chaudhary",Balaji Srinivasan,370000.0,Validation,2021
AdmitKard,2016,Noida,Education And Learning,A tech solution for end to end career advisory to students looking to study abroad.,"Vamsi Krishna, Pulkit Jain, Gaurav Munjal	#REF!",Not filled,1000000.0,Debt,2021
UrbanKisaan,2017,Hyderabad,Consumer Goods And Services,A modern farms close to where your home is. Creating positive change at every step from seed to store ensuring quality and traceability.,"Srinivas Chaganti, Vihari Kanukollu, Sairam Reddy",BASF Venture Capital GmbH,4000000.0,Debt,2021
Aquaconnect,2017,Chennai,Agriculture And Technology,Aquaconnect is a global full-stack aquaculture technology venture that provides data-driven farm advisory and marketplace solutions to fish and shrimp farmers,Rajamanohar,"Rebright Partners, Flourish Ventures",4000000.0,Validation,2021
Vah Vah!,2020,Bangalore,Education And Learning,A mission to educate India and make its young and dynamic population job ready.,"Shailesh Daxini, Akash Senapaty, Muthukaleeshwaran Subbiah",Sequoia Surge,1800000.0,Debt,2021
LetsDressUp,2019,Gurugram,Technology And Software,Building India's version of Stitch Fix,Aditya B,"Titan Capital, Sequoia Capital",300000.0,Validation,2021
Sapio Analytics,2019,Mumbai,Technology And Software,Aim to provide the most intelligent AI-powered policy making solutions for government institutions across the world.,"Ashwin Srivastava, Hardik Somani, Prashant Nikam",Parthiv Group,150000.0,Debt,2021
BHyve,2020,Mumbai,Human Resources And Consultancy,A Future of Work Platform for diffusing Employee Tacit Knowledge and enabling Peer Learning Networks,Backed by 100x.VC,"Omkar Pandharkame, Ketaki Ogale",300000.0,Debt,2021
Indi Energy,2019,Roorkee,Energy And Environment,"Indi Energy is an energy storage startup involved in R&D of next generation battery technologies, with superior performance than current counterparts.",Dr. ASIT SAHOO,Mumbai Angels Network,4000000.0,Validation,2021
The Ayurveda Co,2021,Gurugram,Consumer Goods And Services,The Ayurveda Co. represents things that are all Ayurvedic at heart and are suited for the contemporary landscape.,"Param Bhargava, Shreedha Singh","GetVantage, Velocity, Shiprocket Capital",4000000.0,Debt,2021
Pratilipi,2015,Bangalore,Marketing And Advertising,"Pratilipi is the largest Indian language self-publishing platform with over 350,000 authors and more than 28,000,000 unique monthly readers.",Ranjeet Pratap Singh,"Krafton Inc, Omidyar",48000000.0,Equity,2021
Ati Motors,2017,Bangalore,Automotive,Autonomous industrial vehicle maker,"Saurabh Chandra, Saad Nasser","Blume Ventures, Exfinity Venture Partners",35000000.0,Validation,2021
peAR,2018,Mumbai,Technology And Software,An AR / VR tech based Start-up in Mumbai.,"Dharmin Vora, Dhruvesh Mehta, Parth Vora",Inflection Point Ventures,300000.0,Validation,2021
Gourmet Garden,2019,Bangalore,Agriculture And Technology,"100% contamination free, pesticide free naturoponically grown vegetables.",Arjun Balaji,"Beyond Next Ventures, M Venture Partners",3000000.0,Debt,2021
The Sleep Company,2019,Mumbai,Consumer Goods And Services,Patent Pending sleep technology developed by actual Rocket Scientists and sleep experts after years of research.,Not filled,Fireside Ventures,1000000.0,Validation,2021
TyrePlex,2020,New Delhi,E-Commerce And Retail,Tyreplex is digitizing the tyre dealers in India.,"Puneet Bhaskar, Rupendra Pratap Singh",AdvantEdge Founders,4000000.0,Validation,2021
ION Energy,2016,Mumbai,Automotive,Advanced Electronics & Software Supplier for Electric Vehicles & Battery Energy Storage,Akhil Aryan,Not filled,3600000.0,Validation,2021
Digit Insurance,2016,Bangalore,Finance And Technology,"Digit becomes the first Unicorn of 2021, valued at $1.9B.",Kamesh Goyal,"Faering Capital, Sequoia Capital India, IIFL Alternate Asset Managers",200000000.0,Scaling,2021
FRAAZO,2020,Mumbai,Consumer Goods And Services,FRAAZO is Mumbai's favourite App for Fresh Vegetables and Fruits coming straight from the Farm to your Doorstep within 18 Hours.,"Atul Kumar, Aashish Krishnatre","Sixth Sense Ventures, NABVENTURES",11000000.0,Early Traction,2021
Licious,2015,Bangalore,Consumer Goods And Services,"Licious is a consumer food company, focussed at delighting the world with an unmatched range of meat & meat products.","Abhay Hanjura, Vivek Gupta","Temasek, Multiples PE",192000000.0,Scaling,2021
WinZO,2018,New Delhi,Consumer Goods And Services,WinZO is the largest social gaming and entertainment platform in India.,Paavan Nanda,Griffin Gaming Partners,65000000.0,Scaling,2021
Furlenco,2012,Bangalore,Consumer Goods And Services,Furlenco is a different furniture company.,Ajith Mohan Karimpana,Zinnia Global,100000000.0,Equity,2021
Skylark Drones,2014,Bangalore,Defence And Aviation,"Enterprise drone solutions that help plan, build, and sustain the world we live in.",Mughilan Thiru Ramasamy,"InfoEdge Ventures, IAN Fund",3000000.0,Validation,2021
Leegality,2016,Gurugram,Technology And Software,"The market standard for eSign, eStamp and Document Workflow in India. Eliminating paper from paperwork since 2016",Shivam Singla,"IIFL, Mumbai Angels",4000000.0,Validation,2021
