Company_Brand,Founded,HeadQuarter,Sector,What_it_does,Founders,Investor,Amount,Stage,Year
Unbox Robotics,2019.0,Bangalore,Ai Startup,"Unbox Robotics builds on-demand AI-driven warehouse robotics solutions, which can be deployed using limited foot-print, time, and capital.","Pramod Ghadge, Shahid Memon","BEENEXT, Entrepreneur First",1200000.0,Seed,2021
upGrad,2015.0,Mumbai,Edtech,UpGrad is an online higher education platform.,"Mayank Kumar, Phalgun Kompalli, Ravijot Chugh, Ronnie Screwvala","Unilazer Ventures, IIFL Asset Management",120000000.0,Series E,2021
Lead School,2012.0,Mumbai,Edtech,LEAD School offers technology based school transformation system that assures excellent learning for every child.,"Smita Deorah, Sumeet Mehta","GSV Ventures, Westbridge Capital",30000000.0,Series D,2021
Bizongo,2015.0,Mumbai,B2B E-Commerce,Bizongo is a business-to-business online marketplace for packaging products.,"Aniket Deb, Ankit Tomar, Sachin Agrawal","CDC Group, IDG Capital",51000000.0,Series C,2021
FypMoney,2021.0,Gurugram,Finance,"FypMoney is Digital NEO Bank for Teenagers, empowering them with financial literacy and ease of secured financial transactions.",Kapil Banwari,"Liberatha Kallat, Mukesh Yadav, Dinesh Nagpal",2000000.0,Seed,2021
Urban Company,2014.0,New Delhi,Home Services,"Urban Company (Formerly UrbanClap) is a home and beauty services platform in India, Middle East, Singapore and Australia","Abhiraj Singh Bhal, Raghav Chandra, Varun Khaitan",Vy Capital,188000000.0,Fresh Funding,2021
Comofi Medtech,2018.0,Bangalore,Healthtech,Comofi Medtech is a healthcare robotics startup.,Gururaj KB,"CIIE.CO, KIIT-TBI",200000.0,Seed Funding,2021
Qube Health,2016.0,Mumbai,Healthtech,India's Most Respected Workplace Healthcare Management Company,Gagan Kapur,Inflection Point Ventures,4000000.0,Series C,2021
Vitra.ai,2020.0,Bangalore,Tech Startup,Vitra.ai is an AI-based video translation platform,Akash Nidhi PS,Inflexor Ventures,4000000.0,Series A,2021
Taikee,2010.0,Mumbai,E-Commerce,"Taikee is the ISO-certified, B2B e-commerce platform of Peel-Works, enabling better lives for corner stores.","Nidhi Ramachandran, Sachin Chhabra",Inflection Point Ventures,1000000.0,Series A+,2021
Fitterfly,2016.0,Mumbai,Healthtech,"Fitterfly offers customized and personalized wellness programs for diabetes PCOS, pregnancy, weight loss, pediatric and nutrition.",Dr Arbinder Singal,"9Unicorns Accelerator Fund, Metaform Ventures",3000000.0,Series A+,2021
FreeStand,2017.0,New Delhi,B2B Service,FreeStand enables FMCG brands to execute trackable and scalable product sampling campaigns.,"Konark Sharma, Sneh Soni","SucSEED Indovation, IIM Calcutta Innovation Park",100000.0,Series A+,2021
MyDentalPlan,2014.0,Bangalore,Helathcare,My Dental Plan provides dental care packages and services.,"Sai Srinivas Kiran G, Shubham Malhotra",Safe Planet Medicare,700000.0,Seed,2021
Freyr Energy,2014.0,Hyderabad,Renewable Energy,"Freyr Energy is a company that provides full service solar provider based in Hyderabad, India.","Radhika Choudary, Saurabh Marda","Impact Partners, C4D Partners",2000000.0,Series D1,2021
DealShare,2018.0,Jaipur,E-Commerce,DealShare is a Social Commerce Startup,"Sankar Bora, Sourjyendu Medda, Vineet Rao","Tiger Global Management, InnoVen Capital",9000000.0,Early Seed,2021
Tessolve,1993.0,Bangalore,Electronics,"Tessolve Semiconductor offers engineering in semiconductor design, test/product engineering, failure analysis, systems design.","P Raja Manickam, Srinivas Chinamilli, Veerappan V",Novo Tellus Capital,40000000.0,Series E,2021
Smart Joules,2014.0,New Delhi,Renewable Energy,Smart Joules is an energy management company.,"Arjun P Gupta, Ujjal Majumdar, Sidhartha Gupta","Raintree Family Office, ADB arm",49000000.0,Seed,2021
ORAI,2020.0,Bangalore,It Startup,AI-Powered Robotic Virtual Assistant (RVA) for Amplifying Performance of Poor quality leads and bring more MQL and SQL,"Swapnil Jain, Sujit Das Biswas",Inflection Point Ventures,400000.0,Series A+,2021
ixamBee,2016.0,New Delhi,Edtech,ixamBee is to provide best online learning experience for preparation of competitive exams.,Chandraprakash Joshi,"Mumbai Angels, Narendra Shyamsukha",300000.0,Seed,2021
CoinSwitch Kuber,2017.0,Bangalore,Finance,CoinSwitch Kuber is an India-based cryptocurrency exchange platform.,"Ashish Singhal, Govind Soni, Vimal Sagar Tiwari","Paradigm, Kunal Shah",25000000.0,Series B,2021
Razorpay,2014.0,Bangalore,Finance,"Razorpay is a platform that enables businesses to accept, process, and disburse payments.","Harshil Mathur, Shashank Kumar","Matrix Partners India, GIC",160000000.0,Series E,2021
Uable,2020.0,Bangalore,Edtech,Uable offers role based programmes to empower children to explore different domains.,Saurabh Saxena,"Chiratae Ventures, JAFCO Asia",4000000.0,Seed,2021
ZFW Hospitality,2015.0,New Delhi,Food & Beverages,Creating a sustainable and scalable cloud kitchen network.,Madhav Kasturia,"Mumbai Angels Network, Expert DOJO",150000.0,Series E,2021
Optimized Electrotech,2017.0,Ahmadabad,Aeorspace,"Long distance, multispectral Surveillance Equipment for Defense, Aerospace, Critical Asset Protection","Anil Yekkala, Dharin Shah, Kuldeep Saxena, Purvi Shah, Sandeep Shah",GVFL,1800000.0,Bridge,2021
Northern Arc,2008.0,Chennai,Finance,Northern Arc Capital is a Non-Banking Finance Company that provides borrows with access to debt investors.,Kajal Ilmi,"Kotak Mahindra Bank, FMO",5000000.0,Seed Funding,2021
Chara,2019.0,Bangalore,Deep Tech,"A scalable, cloud-controlled, and rare earth mineral free Hardware and Software platform for the Switched Reluctance Motor and other magnet free motor technologies.","Bhaktha Keshavachar, Ravi Prasad Sharma, Mahalingam Koushik",Kalaari Capital,850000.0,Seed,2021
Sirona Hygiene,2015.0,New Delhi,Healthtech,Solving unaddressed Intimate & Menstrual Hygiene issues with our award-winning innovative & modern products.,"Deep Bajaj, Mohit Bajaj","NB Ventures, IAN Fund",3000000.0,Series A,2021
Pristyn Care,2018.0,Gurugram,Healthtech,Pristyn Care is Health Care Startup that is disrupting Elective Surgery Procedures,Harsimarbir (Harsh) Singh,"Sequoia Capital India, Hummingbird Ventures",53000000.0,Series D,2021
TrulyMadly,2013.0,New Delhi,Dating,Trulymadly is a dating platform that uses a match making algorithm.,"Hitesh Dhingra, Rahul Kumar, Sachin Bhatia","Gaurav Munjal, Snehil Khanor",2000000.0,Series E,2021
Vidyakul,2018.0,Unknown,Edtech,Vidyakul is an vernacular e-learning platform that helps state board students to learn academics via pre-recorded and live lectures,"Raman Garg, Tarun Saini","JITO Angel Network, SOSV",500000.0,Seed,2021
Jambox Games,2021.0,Bangalore,Gaming,"A competitive game publishing platform to help developers in India and Southeast Asia to publish their games, and compete with the global incumbents.",Ravi Vyas,Unicorn India Ventures,1100000.0,Seed,2021
Miko,2015.0,Mumbai,Robotics,"Miko is an advanced robotics startup focusing on robotics, AI & IoT.","Chintan Raikar, Prashant Iyengar, Sneh Vaswani","Chiratae Ventures, YourNest Venture Capital",6000000.0,Series B+,2021
SuperK,2019.0,Andhra Pradesh,Retail,SuperK is a full-stack solution to empower small format retail stores in India.,Neeraj Menta,STRIVE VC,800000.0,Seed,2021
TagZ Foods,2019.0,Bangalore,Food,TagZ Foods is a supplier of snacks and food products.,"Anish Basu Roy, Sagar Bhalotia",Venture Catalysts,500000.0,Seed Funding,2021
Fuel Buddy,2017.0,New Delhi,Oil And Energy,FuelBuddy is the FIRST legal private company in India to have permissions in place to deliver fuel. FUELDELIVERY APP.,Aditya Singh,Jaipuria Family Office,1000000.0,Series D1,2021
M1xchange,2017.0,Gurugram,Finance,M1 an online exchange for TReDS set up under the approval RBI to facilitate discounting of invoices on a PAN India basis.,Sundeep Mohindru,Amazon,10000000.0,Series B,2021
Spintly,2017.0,Goa,Tech Startup,Wireless cloud based access control platform,Rohin Parkar,Riso Capital,500000.0,Series H,2021
EF Polymer,2018.0,Rajsamand,Agritech,Sustainable Agriculture by creating sustainable inputs solution for agriculture to save water and fertilizer with enhancing yield.,Narayan Lal Gurjar,MTG Ventures,200000.0,Fresh Funding,2021
boAt,2016.0,New Delhi,Electronics,boAt is a consumer electronics and lifestyle company.,"Aman Gupta, Sameer Mehta","Qualcomm Ventures, Warburg Pincus",6000000.0,Series B,2021
TruNativ,2019.0,Mumbai,Food & Beverages,TruNativ Foods & Beverages Pvt Ltd,"Pranav Malhotra, Mamta Malhotra",9Unicorns,4000000.0,Seed,2021
iBus,2010.0,Bangalore,Telecommuncation,iBus Networks is an in-building connectivity solutions company,"Ram Sellaratnam, Sunil Menon and Subash Vasudevan",Morgan Stanley,21000000.0,Series C,2021
Puresh Daily,2019.0,Ranchi,Milk Startup,PUREandFRES-Milk delivers fresh milk directly from its farm to home. Fresh Milk without any trace of chemicals is packed and sealed in glass bottle.,"Manish Piyush, Ayush Kumar","Alfa Ventures, Agility Venture Partners",100000.0,Seed,2021
LearnVern,2016.0,Ahmadabad,Edtech,LearnVern.com is a training portal where anyone can learn any course in vernacular languages for free.,"Niral Modi, Aditi Modi",Titan Capital,1000000.0,Pre-Seed,2021
LimeChat,2020.0,"Faridabad, Haryana",Ai Chatbot,Limechat provides a personalised shopping experience for D2C companies on chat platforms using L3 conversational AI.,"Aniket Bajpai, Nikhil Gupta","Stellaris Venture Partners, Ramakant Sharma",7500000.0,Seed,2021
Dybo,2019.0,Bangalore,It,Product Visualisation Technology for Commerce,Dhawal Jain,Spanache,100000.0,Seed,2021
moEVing,2021.0,Gurugram,Transport,"Delivering clean, cost-effective and efficient mobility solutions.",VIKASH MISHRA,Tiger Global,1000000.0,Seed,2021
WeWork India,2017.0,Bangalore,Hospitality,"Transform buildings into beautiful, collaborative workspaces and provide infrastructure, services, events and tech",Karan Virwani,9Unicorns,26000000.0,Series A+,2021
Solethreads,2018.0,Gurugram,Fashion,SOLETHREADS is a ‘Made in India’ footwear brand that’s creating a flip flop revolution.,Vikram Iyer,"DSG Consumer Partners, Saama Capital",1000000.0,Series A,2021
Beldara,2018.0,Mumbai,E-Commerce,"BELDARA.COM IS A GLOBAL B2B marketplace, enables businesses to sell worldwide.",Bhagwan (Pradeep) Khandekar,Hindustan Media Ventures,7400000.0,Series G,2021
CredFlow,2020.0,New Delhi,Finance,CredFlow provides financial solutions to automate your cashflows.,Kunal Aggarwal,"Stellaris Venture Partners, Omidyar Network India, Flourish Ventures",2000000.0,Seed,2021
Do Your Thng,2018.0,Gurugram,Marketing,World's first shared economy platform for digital assets.,Ankit Agarwal,"Angelbay Holdings, Faad Network",1500000.0,Series C,2021
Oye Rickshaw,2017.0,Gurugram,Transport,Oye Rickshaw is an electric vehicle energy solutions company that connects people with public transportation using a booking app.,"Akash Deep, Mohit Sharma","Alteria Capital, Chiratae Ventures",3000000.0,Series B,2021
Legitquest,2017.0,New Delhi,Legaltech,LegitQuest is a legal-tech company that operates a legal research platform with Indian case laws.,"Himanshu Puri, Karan Kalia, Rohit Shukla","WaterBridge Ventures, Info Edge",600000.0,Series A+,2021
Swiggy,2014.0,Bangalore,Food Delivery,Swiggy is an on-demand food delivery platform that brings food from neighborhood restaurants directly to customers' doors.,Saurabh Saxena,"Carmignac, Falcon Edge Capital",800000000.0,Series F,2021
AntWak,2019.0,Bangalore,Edtech,AntWak provides a video platform for e-learning service.,"Basav Nagur, Joybroto Ganguly, Sudhanshu Shekhar, Sumit Gupta, Sriramkumar Sundararaman","Vaibhav Domkundwar, Kunal Shah",4000000.0,Seed,2021
PlayShifu,2016.0,Bangalore,Edtech,PlayShifu is an EdTech startup that offers teaching/learning tools for kids (4-12 years of age).,"Dinesh Advani, Vivek Goyal","Chiratae Ventures, Bharat Innovation Fund",17000000.0,Series B,2021
Pitstop,2015.0,Bangalore,Transport,Pitstop offers general repair and maintenance services for cars through its doorstep service vehicles.,"Mihir Mohan Mishra, Nirant Ramakuru, Ruchi Deepak","Acko Technology, Services, LetsVenture",3500000.0,Pre-Seed,2021
Lendingkart,1999.0,Gujarat,Finance,Lendingkart is an online financing company dedicated to help entrepreneurs and small businesses with Working Capital Loans.,"Harshvardhan Lunia, Mukul Sachan",Sequoia Capital,15000000.0,Series D,2021
CRED,2018.0,Bangalore,Finance,CRED is a members-only credit card management and bill payments platform that rewards users every time they pay their credit card bills.,Kunal Shah,"Dragoneer Investment Group, Tiger Global Management",215000000.0,Series D,2021
Karnival,2015.0,Bangalore,Saas Startup,A SAAS platform for retailers and brands to create wonderful post purchase customer journeys using smart receipts technology,Neeraj Tyagi,http://100x.vc/,2500000.0,Seed,2021
PharmEasy,2015.0,Mumbai,Healthtech,"PharmEasy is a health tech startup offering services such as teleconsultation, medicine deliveries, and diagnostic test sample collection.","Byju Raveendran, Divya Gokulnath","TPG Growth, Caisse de Depot et Placement du Quebec",350000000.0,Series E,2021
WESS,1989.0,Mumbai,Renewable Energy,Waaree is India's Largest Solar Module Manufacturer & fastest growing EPC company with Presence across 68 countries.,Hitesh Doshi,Better Capital,2000000.0,Seed,2021
ShopSe,2020.0,Mumbai,Finance,Make purchases online or at neighborhood store in easy EMIs through ShopSe.,"Pallav Jain, Abhishek Nimonkar, Yagnesh Desai","Chiratae Ventures, BEENEXT",5500000.0,Series G,2021
Fantasy Akhada,2020.0,Gurugram,Fantasy Sports,Fantasy Akhada offers fantasy sports platform for cricket and football.,Amit Purohit,Harsha Bhogle,600000.0,Private Equity,2021
Rage Coffee,2018.0,New Delhi,Food & Beverages,Rage Coffee is infused with plant based vitamins. These 100% natural extracts are typically found in foods.,Bharat Sethi,"GetVantage, Prakash Katama",4000000.0,Series I,2021
Groww,2017.0,Bangalore,Finance,Groww is an investment platform that offers a new way of investing money with stockbroking and direct mutual funds.,"Harsh Jain, Ishan Bansal, Lalit Keshre, Neeraj Singh","Tiger Global Management, Y Combinator Continuity Fund",83000000.0,Series D,2021
Avanti Finance,2016.0,Bangalore,Finance,Avanti Finance lends relatively large but trust-based loans without formal credit footprint.,"Vineet Khanna, Varun Sadana, Aman Tekriwal",Michael & Susan Dell Foundation,26000000.0,Series A,2021
Kudos,2014.0,Pune,Finance,"Kudos is a full stack NBFC, a digital lending engine with an in-built API lending protocol layer of over 20+ API’s.",Naresh Vigh,Marquee fintech founders,4000000.0,Fresh Funding,2021
OfBusiness,2015.0,Gurugram,Finance,OfBusiness is a financing platform that offers smart financing to SMEs.,"Aman Gupta, Sameer Mehta","Falcon Edge India, Norwest Venture Partners",110000000.0,Seed,2021
Superpro.ai,2019.0,Bangalore,Video Communication,Enabling independent professionals to bring offline consulting online with AI,"Gaurav Tripathi, Sagar Ramteke, Vijay Goel, Vivek Kumar","SOSV, Omphalos Ventures India",3000000.0,Seed,2021
ShareChat,2015.0,Bangalore,Social Media,ShareChat is a social networking and regional content platform.,"Ankush Sachdeva, Bhanu Pratap Singh, Farid Ahsan","Twitter Ventures, Pawan Munjal",500000000.0,Venture - Series Unknown,2021
WiT-ACE,2020.0,Gurugram,Skill Development,"Offer accelerated career experiences for women by Enabling, Engaging & Employing them to be in decision making roles.",Anuranjita Kumar,CitiusTech,1000000.0,Seed,2021
Spinny,2015.0,Gurugram,Retail,Spinny is a used car buying platform enabling trustworthy and hassle-free transactions.,"Mohit Gupta, Niraj Singh, Ramanshu Mahaur","Arena Holdings, Think Investments",65000000.0,Series C,2021
Alteria Capital,2018.0,Mumbai,Finance,Alteria Capital is a Venture debt firm .,Vinod Murali,Blue Ashva Capital,150000000000.0,Venture - Series Unknown,2021
Safexpay,2017.0,Thane,Finance,SafexPay is set up with the aim to build digital payments businesses and channel platforms encompassing payment gateways,Ravi Gupta,"T Choithrams BVI, Ardor",6000000.0,Debt Financing,2021
PumPumPum,2018.0,Gurugram,Rental,Pumpumpum is a car rental company.,"Tarun Lawadia, Sameer Kalra",Anicut Angel Fund,700000.0,Seed Funding,2021
Speciale Invest,2017.0,Bangalore,Finance,Speciale Invest is an early stage investor focusing on Tech-driven/Deep-tech ventures.,"Vishesh Rajaram, Arjun Rao",Unicorn India Ventures,10000000.0,Fresh Funding,2021
Eunimart,2016.0,Hyderabad,E-Commerce,Eunimart is a one stop solution for merchants to create a difference by selling globally.,"Saikat Roy, Shayak Mazumder","SucSEED Venture Partners, TMT Connekt",700000.0,Seed Round,2021
Meesho,2015.0,Bangalore,E-Commerce,Meesho operates as an online reselling platform that enables anyone to start a business without investment.,"Sanjeev Barnwal, Vidit Aatrey","SAIF Partners, Venture Highway",300000000.0,Venture - Series Unknown,2021
CareerLabs,2019.0,Bangalore,Edtech,"Aim to help students become future-ready, setting them on a path to success that suits them best.","PN Santosh, Prasanna Alagesan, Krithika Srinivasan",Global Founders Capital,2200000.0,Series C,2021
Uable,2020.0,Bangalore,Edtech,Uable are on a bold mission to redefine the future for millions of teenagers around the world.,Saurabh Saxena,"JAFCO Asia, Chiratae Ventures",35000000.0,Seed,2021
Zoko,2016.0,Bangalore,Tech Startup,"Zoko makes it easy for businesses to do Sales, Marketing & Customer Support on WhatsApp.","Arjun Paul, Aromal Sivadasan",Y Combinator,140000000.0,Seed,2021
GetWork,2019.0,Gurugram,Recruitment,GetWork is a campus recruiting platform to post your jobs and hire across dozens of colleges at once.,Rahul Veerwal,Artha Venture Fund,200000.0,Seed,2021
Easebuzz,2015.0,Pune,E-Commerce,Easebuzz is an easy to use portal which allows you to start an online business and sell your favorite products with a free online store.,Rohit Prasad,"Jitendra Gupta, Amrish Rau",4000000.0,Series A,2021
Chingari,2018.0,Bangalore,Social Media,Chingari operates as a short video platform.,Sumit Ghosh,"FJ Labs, Brian Norgard",13000000.0,Pre-Seed,2021
DusMinute,2017.0,Bangalore,Retail,DusMinute aims to transform how communities live by giving them access to world-class amenities at their doorstep.,Apoorva Mishra,Indian Angel Network,1100000.0,Seed Funding,2021
Onsurity,2020.0,Bangalore,Healthcare,Onsurity is an employee healthcare platform providing a monthly healthcare membership with group health insurance to emerging businesses.,"Kulin Shah, Yogesh Agarwal","Jitendra Gupta, Harsh Shah",4000000.0,Series E,2021
Karbon Card,2019.0,Bangalore,Finance,Prime objective is to empower Indian startups by creating the right financial products starting with a high-limit corporate credit card with unlimited benefits,"Pei-fu Hsieh, Amit Jangir, Kartik Jain, Sunil Sinha",Y Combinator,4000000.0,Series G,2021
Factors.AI,2020.0,Bangalore,Saas Startup,"Factors.AI is a Marketing Analytics platform providing sophisticated omnichannel, every-touch attribution technology and unparalleled performance insights for Marketers","Aravind Murthy, Praveen Das, Srikrishna Swaminathan","Elevation Partners, Emergent Ventures",2000000.0,Series H,2021
Elevar,2017.0,Mumbai,Sports,"A Revolutionary Sports Brand, Engineered For Those Who Want More.","Kunal Joshi, Pranav Marwah","Kalaari Capital, Dream Capital",2000000.0,Series G,2021
Studio Sirah,2020.0,Bangalore,Computer Games,Studio Sirah is founded with a belief in the increasing sophistication of the Indian gamer and the whitespace of midcore India-first games.,"Abhaas Shah, Prateek Shah",Lumikai,800000.0,Early Seed,2021
OTO Capital,2018.0,Mumbai,Finance,The Future Of Vehicle Ownership!,"Harsh Saruparia, Sumit Chhazed",Matrix Partners India,6000000.0,Seed Round,2021
1Bridge,2016.0,Bangalore,Consumer Goods,"Village Commerce Network - Bridging Aspirations, Creating Opportunities, Bringing Prosperity & Abundance to our village","Madan Padaki, Anil Kumar, M Chakrawarty",C4D Partners,2500000.0,Debt Financing,2021
Skeps,2018.0,Gurugram,Finance,"A blockchain products company, developing a proprietary product in the FinTech space","Mayank Tewari, Tushar Srivastava",Bertelsmann India,9500000.0,Seed,2021
Curefoods,2020.0,Bangalore,Food & Beverages,Healthy & nutritious foods and cold pressed juices produced in Edinburgh. Currently distributing wholesale within the Edinburgh region.,Ankit Nagori,"Iron Pillar, Nordstar, Binny Bansal",13000000.0,Fresh Funding,2021
TartanSense,2015.0,Bangalore,Information Technology,TartanSense unlocks value for small farm holders by working at the intersection of robotics and AI assisted computer vision.,Jaisimha Rao,"FMC, Omnivore, Blume Ventures",5000000.0,Debt Financing,2021
Bewakoof,2012.0,Mumbai,Apparel & Fashion,"Bewakoof is a lifestyle fashion brand that makes creative, distinctive fashion for the trendy, contemporary Indian.",Prabhkiran Singh,InvestCorp,8000000.0,Venture - Series Unknown,2021
Kirana247,2018.0,New Delhi,Transport,An on-demand FMCG supply chain company leveraging a deep tech-enabled micro warehousing model to serve Kirana stores.,"Tarun Jiwarajka, Pankhuri Jiwarajka",Anicut Angel Fund,1000000.0,Seed Funding,2021
FanPlay,2020.0,Computer Games,Computer Games,A real money game app specializing in trivia games,YC W21,"Pritesh Kumar, Bharat Gupta",4000000.0,Series I,2021
NeoDocs,2020.0,Mumbai,Healthtech,"Neodocs is a part of India's prominent Social Impact Accelerator program, AISEA.","Nikunj Malpani, Anurag Meena, Pratik Lodha","Y Combinator, 9Unicorns, Titan Capital",4000000.0,Series F,2021
IsGoingOnline,2015.0,Cochin,Retail,Kochi-based digital catalogue and marketplace IsGoingOnline,Eobin Alex,"Unicorn India Ventures, SEA Fund, Devdatt Shah",200000.0,Private Equity,2021
Camp K12,2010.0,Gurugram,Edtech,"Camp K12 is a global online school for 21st century skills, teaching Coding and other STEAM subjects to kids age 6-18 via LIVE, interactive, gamified online sessions",Anshul Bhagi,"Matrix Partners India, Elevation Capital",12000000.0,Series A,2021
Elda Health,2020.0,Bangalore,Healthcare,"Elda Health is a digital wellness platform that understands women intimately and offers a holistic wellness solution through physical, mental and social interventions.","Vineet Khanna, Varun Sadana, Aman Tekriwal","Avaana Capital, Orios Ventures",1500000.0,Seed Round,2021
Sporjo,2020.0,Mumbai,Sportstech,A one stop destination to build a successful career in the Indian sports industry!,G Srinivvasan,Punit Balan,2000000.0,Fresh Funding,2021
Advantage Club,2014.0,Mumbai,Hrtech,"Advantage Club is India's largest employee engagement platform, Provide end to end employee benefit management with state of the art products like:","Sourabh Deorah, Smiti Bhatt Deorah","Y Combinator, Broom Ventures, Kunal Shah",1700000.0,Fresh Funding,2021
SuperGaming,2017.0,Pune,Gaming,"At SuperGaming, building India's best gaming company.","Roby John, Sanket Nadhani, Navneet Waraich","Skycatcher, AET Fund, BAce Capital, Dream Incubator, 1Up Ventures",5500000.0,Bridge,2021
Ruptok,2020.0,New Delhi,Finance,"Ruptok fintech Pvt. Ltd. is an online gold loan service provider , with attractive interests rate .",Ankur Gupta,Eclear Leasing,1000000.0,Series F,2021
Curefoods,2020.0,Bangalore,Food & Beverages,Healthy & nutritious foods and cold pressed juices produced in Edinburgh. Currently distributing wholesale within the Edinburgh region.,Ankit Nagori,"Iron Pillar, Nordstar, Binny Bansal",13000000.0,Series F,2021
TartanSense,2015.0,Bangalore,Information Technology,TartanSense unlocks value for small farm holders by working at the intersection of robotics and AI assisted computer vision.,Jaisimha Rao,"FMC, Omnivore, Blume Ventures",5000000.0,Series A,2021
Bewakoof,2012.0,Mumbai,Apparel & Fashion,"Bewakoof is a lifestyle fashion brand that makes creative, distinctive fashion for the trendy, contemporary Indian.",Prabhkiran Singh,InvestCorp,8000000.0,Series B+,2021
Kirana247,2018.0,New Delhi,Transport,An on-demand FMCG supply chain company leveraging a deep tech-enabled micro warehousing model to serve Kirana stores.,"Tarun Jiwarajka, Pankhuri Jiwarajka",Tiger Global,1000000.0,Seed,2021
FanPlay,2020.0,Computer Games,Computer Games,A real money game app specializing in trivia games,YC W21,"Pritesh Kumar, Bharat Gupta",4000000.0,Fresh Funding,2021
NeoDocs,2020.0,Mumbai,Healthtech,"Neodocs is a part of India's prominent Social Impact Accelerator program, AISEA.","Nikunj Malpani, Anurag Meena, Pratik Lodha","Y Combinator, 9Unicorns, Titan Capital",4000000.0,Series B+,2021
IsGoingOnline,2015.0,Cochin,Retail,Kochi-based digital catalogue and marketplace IsGoingOnline,Eobin Alex,"Unicorn India Ventures, SEA Fund, Devdatt Shah",200000.0,Debt Financing,2021
Camp K12,2010.0,Gurugram,Edtech,"Camp K12 is a global online school for 21st century skills, teaching Coding and other STEAM subjects to kids age 6-18 via LIVE, interactive, gamified online sessions",Anshul Bhagi,"Matrix Partners India, Elevation Capital",12000000.0,Series A,2021
Elda Health,2020.0,Bangalore,Healthcare,"Elda Health is a digital wellness platform that understands women intimately and offers a holistic wellness solution through physical, mental and social interventions.","Sai Srinivas Kiran G, Shubham Malhotra","Avaana Capital, Orios Ventures",1500000.0,Seed,2021
Sporjo,2020.0,Mumbai,Sportstech,A one stop destination to build a successful career in the Indian sports industry!,G Srinivvasan,Punit Balan,2000000.0,Seed Round,2021
Advantage Club,2014.0,Mumbai,Hrtech,"Advantage Club is India's largest employee engagement platform, Provide end to end employee benefit management with state of the art products like:","Sourabh Deorah, Smiti Bhatt Deorah","Y Combinator, Broom Ventures, Kunal Shah",1700000.0,Series D1,2021
