Company_Brand,Founded,HeadQuarter,Sector,What_it_does,Founders,Investor,Amount,Stage,Year
GENLEAP,2021,Haryana,Human Resources And Consultancy,GenLeap is India’s first self-discovery and career lifecycle management platform.,"Sachin Sandhir, Nimish Gupta, Nitin Thakur, Shweta Kataria","Vivek Vaidya, Kevin Donlon, Ayush Singh",8000000.0,Validation,2021
Planys,2015,Chennai,Technology And Software,Planys is an Indian deep tech start-up creating a paradigm shift in the underwater inspection industry.,"Tanuj Jhunjhunwala, Vineet Upadhyay, Rakesh Sirikonda","Kieretsu Forum, Lets Venture, Shell",1600000.0,Validation,2021
Wonderchef,2009,Mumbai,Consumer Goods And Services,"Wonderchef Cookware and Appliances is a perfect blend of health, taste, and convenience that inspires us to 'cook with pride'.",Ravi Saxena,"Sixth Sense Ventures, Godrej Family office, Malpani Group",20000000.0,Equity,2021
GoKwik,2020,New Delhi,Technology And Software,GoKwik is a platform for solving shopping experience problems on e-commerce websites on the internet.,"Chirag, Vivek Bajpai, Ankush Talwar",Sequoia Capital India,15000000.0,Early Traction,2021
Velocity,2020,Bangalore,Finance And Technology,"Velocity provides revenue based financing, up to Rs 3 crores, for marketing and inventory spends of online businesses.","Saurav Swaroop, Abhiroop Medhekar, Atul Khichariya",Valar Ventures,20000000.0,Early Traction,2021
SalaryBox,2020,Gurugram,Finance And Technology,SalaryBox is solution that makes employee management effortless.,"Nikhil Goel, Peeyush Goyal","Y-Combinator, AME Cloud Ventures, Gokul Rajaram",4000000.0,Validation,2021
Boingg,2019,Gurugram,Technology And Software,D2C furniture brand,"Neha Indoria, Dhruvan Barar",Inflection Point Ventures,200000.0,Validation,2021
Tickertape,2019,Bangalore,Finance And Technology,"Tickertape provides data, information & content for Indian stocks, ETFs & indices",Ujjwal Ankur,Smallcase,5000000.0,Debt,2021
Zenpay Solutions,2019,New Delhi,Finance And Technology,"India’s fastest growing fintech company, which has revolutionized the ultimate banking experience especially by reaching out to thousands of blue-collared employees by promoting digital banking solutions across India.",Ankit Bhargava,"The StarupLab, AngelBay",4000000.0,Debt,2021
Disprz,2015,Mumbai,Education And Learning,An AI-powered right skilling suite that helps enterprises unlock business potential.,"Subramanian Viswanathan, Kuljit Chadha","Dallas Venture Capital, Mars Growth Capital",13000000.0,Scaling,2021
Inzpira,2021,Trivandrum,Education And Learning,"Inzpira is India's only Live online 1:1 platform for Language Learning & Test Preparation that lets users instantly connect with expert trainers and learn anytime, from anywhere.","Rohith Namboothiri, Sruthy Ramesh","Raj Nair, Gopinath Latpate",300000.0,Validation,2021
Defy,2021,Bangalore,Finance And Technology,Building India's first social crypto exchange,"Bhagaban Behera, Sriharsha Setty, Nakul Kelkar","Y Combinator, Goat VC, JAM Fund, Goodwater Capital",5500000.0,Debt,2021
Mindhouse,2019,Gurugram,Healthcare And Health Technology,Mindhouse is a Yoga & Nutrition driven personalized healthcare platform.,"Pooja Khanna, Pankaj Chaddah","Binny Bansal, General Catalyst",6000000.0,Validation,2021
Homversity,2017,Ahmedabad,Technology And Software,Homversity is the digital ecosystem that aims to support the 93 BN USD student housing & Co-living industry in India.,Saurav Kumar Sinha,Not filled,155000.0,Debt,2021
Toppersnotes,2015,Jaipur,Education And Learning,"Toppersnotes is an edtech company, primarily operating in the test preparation industry.","Ayush Agarwal, Devendra Dhaka, Arpit Bansal",Inflection Point Ventures,1000000.0,Validation,2021
NoBroker.com,2014,Bangalore,Real Estate And Housing,NoBroker is a disruptive force in the Real Estate Industry.,"Akhil Gupta, Amit, Saurabh","General Atlantic, Tiger Global, Moore Strategic Ventures",2100000.0,Scaling,2021
Haber,2017,Pune,Technology Solutions For Industry,"Real-time, automated insights to increase plant efficiency","Vipin Raghavan, Priya Venkat, Arjunan PN",Ascent Capital,20000000.0,Scaling,2021
True Balance,2014,Gurugram,Finance And Technology,"Balancehero India Private Limited (BHI), the wholly owned subsidiary of Balancehero Co. Ltd., Korea which runs and operates mobile App “True Balance”.",Cheolwon Lee,"Northern Arc, Arthmate, Shine Star, E clear, Hinduja",30000000.0,Equity,2021
Recordent,2018,Hyderabad,Finance And Technology,Helping MSMEs collect customer dues faster & reduce risk by checking credit & payment history before offering credit,Winny Patro,"Family Office of Kantamaneni, IIM Calcutta Innovation Park",400000.0,Debt,2021
Koparo,2020,New Delhi,Consumer Goods And Services,Koparo is a direct-to-consumer brand that is addressing the needs of modern Indian families and their homes.,Simran Khara,"Saama Capital﻿, ﻿Titan Capital﻿, DSG Consumer Partners",700000.0,Validation,2021
Indifi,2015,Gurugram,Finance And Technology,Indifi believes in helping small businesses grow by offering loans to those that have potential and intent.,Alok Mittal,"Omidyar Network, Flourish Ventures, Elevar Equity, Accel",40000000.0,Equity,2021
Settl,2020,Bangalore,Real Estate And Housing,Settl. is a technology-driven accommodation platform focused on providing a convenient and high-quality living experience for young millennials.,"Abhishek Tripathi, Bharath Bhaskar, Ashok Reddy","ah! Ventures, We Founder Circle",500000.0,Validation,2021
Park+,2019,New Delhi,Technology And Software,Building an eco-system for car owners which will be a one-stop solution for all their needs.,Amit Lakhotia,"Sequoia Capital, Matrix Partners",25000000.0,Scaling,2021
Simple Energy,2019,Bangalore,Automotive,A Research and development driven company on a mission to build the future of mobility that is electric and connected.,Suhas Rajkumar,Not filled,21000000.0,Validation,2021
Dream Sports,2008,Mumbai,Media And Entertainment,"Dream Sports is India’s leading sports technology company with brands such as Dream11, world’s largest fantasy sports platform",Harsh Jain,"Falcon Edge, DST Global, D1 Capital, Redbird Capital, Tiger Global",840000000.0,Scaling,2021
Spinny,2015,Gurugram,Automotive,Spinny is a new age used car end-to-end platform in India.,"Niraj Singh, Mohit Gupta, Ramanshu Mahaur","Abu Dhabi Growth Fund, Tiger Global",248000000.0,Scaling,2021
Rentomojo,2014,Bangalore,Technology And Software,"Furniture, appliances, electronics, and fitness products on monthly rental subscriptions.",Geetansh Bamania,"Accel, Bain Capital",10000000.0,Equity,2021
Slice,2015,Bangalore,Finance And Technology,"Slice is India's best credit card challenger to pay bills, manage expenses, and unlock rewards","Rajan Bajaj, Siva Kumar Tangudu","Tiger Global, Insight Partners",220000000.0,Scaling,2021
21K School,2020,Bangalore,Education And Learning,"21K School is India's First Online School that provides a complete online school experience and personalized learning – anytime, anywhere.","Santosh Kumar, Yeshwanth Raj Parasmal, Dinesh Kumar, Joshi Kumar",Ronnie Screwvala,5000000.0,Validation,2021
Adda247,2016,Gurugram,Education And Learning,"The multilingual edtech platform provides 360 degree learning solutions catering to all major educational needs of Tier II, tier III including online courses for  competitive exams","Anil Nagar, Saurabh Bansal",WestBridge Capital,20000000.0,Scaling,2021
Loop Health,2018,Pune,Healthcare And Health Technology,India's first health insurance with unlimited primary care for employees.,"Amrit Singh, Mayank Kale","Elevation, General Catalyst",12000000.0,Equity,2021
Rupifi,2020,Bangalore,Finance And Technology,Embedded Lending for Small Businesses,"Jawaid Iqbal, Dhruv Bhushan",Alteria Capital,1000000.0,Debt,2021
RENEE Cosmetics,2019,Ahmedabad,Consumer Goods And Services,"RENÉE Cosmetics is an Indian makeup brand empowering bold & beautiful women with innovative, cruelty-free products.","Priyank Shah, Ashutosh Valani, Aashka Goradia Goble","Equanimity Ventures, 9Unicorns",1500000.0,Validation,2021
Svish,2020,Gurugram,Consumer Goods And Services,D2C personal hygiene startup,"Ishan, Jaideep Mahajan",Nueva,400000.0,Validation,2021
Progcap,2016,New Delhi,Finance And Technology,"Progcap (Desiderata Impact Ventures Private Limited) is a mission-driven, inclusive financing technology firm","Pallavi Shrivastava, Himanshu Chandra",Tiger Global,30000000.0,Scaling,2021
Smartstaff,2020,Bangalore,Technology And Software,Smartstaff (previously Qikwork) is a full stack blue-collar workforce management platform.,"Arpit Dave, Viral Chhajer, Gnanesh Chilukuri, Aravind Reddy","Blume Ventures, Nexus Venture Partners",4300000.0,Debt,2021
D’Moksha Homes,2020,Mumbai,Fashion And Apparel,"Artisans handcraft exquisite and environment-friendly home linens using only the most sustainable fabrics like linen, hemp, and lyocell.","Nimisha, Manav Dhanda","Apoorva Sharma, The Chennai Angels, Karthik Bhat",570000.0,Validation,2021
ANS Commerce,2017,Gurugram,E-Commerce And Retail,ANS Commerce is India’s #1 full-stack e-commerce enabler helping brands sell online.,"Amit Monga, Nakul Singh, Vibhor Sahare, Sushant Puri","Gokul Rajaram, Venture Catalysts",2200000.0,Validation,2021
Mobileware Technologies,2008,Mumbai,Technology And Software,"A mobile applications development platform for technologies including Symbian, Blackberry, and early versions of iOS and Android.","Amitabh Kanekar, Satyajit Kanekar",Kvanto Payment Services,4700000.0,Debt,2021
GramCover,2016,Noida,Finance And Technology,GramCover is a tech-enabled insurance marketplace for rural India.,Dhyanesh Bhatt,"Siana Capital, Inflexor Ventures, Stride Ventures",7000000.0,Early Traction,2021
BYJU'S,2011,Bangalore,Education And Learning,BYJU’S is India's largest ed-tech company and the creator of India’s most loved school learning app.,"Byju Raveendran, Divya Gokulnath","Oxshott Capital Partners, XN Exponent, Edelweiss",300000000.0,Scaling,2021
Hyperface,2021,Bangalore,Technology And Software,Empowering Brands and Fintechs to offer banking products contextually to their customers.,"Ramanathan RV, Aishwarya Jaishankar","Kunal Shah, Better Capital",1300000.0,Debt,2021
Licious,2015,Bangalore,Consumer Goods And Services,"Licious is a consumer food company, focussed at delighting the world with an unmatched range of meat & meat products.","Vivek Gupta, Abhay",Not filled,52000000.0,Scaling,2021
Chalo,2014,Mumbai,Technology And Software,India’s #1 bus transport technology company.,"Vinayak Bhavnani, Mohit Dubey","Lightrock India, Filter Capital",40000000.0,Scaling,2021
Kaar Technologies,2005,Chennai,Technology And Software,"Kaar Technologies is an SAP global consultancy firm that designs, delivers and deploys cutting-edge SAP solutions for businesses around the world.",Maran Nagarajan,BlackSoil,4000000.0,Debt,2021
Kissan Pro,2021,Jharkhand,Agriculture And Technology,"Full stack solution on agri advisory, input purchase and market linkage",Ravi Dasoundhi,EKKI,4000000.0,Debt,2021
Sunstone Eduversity,2011,Gurugram,Education And Learning,Sunstone Eduversity is a one-of-its-kind business school operating in an asset-light model since 2011.,"Ashish Munjal, Piyush Nangru",WestBridge Capital,28000000.0,Scaling,2021
Ozonetel,2007,Hyderabad,Technology Solutions For Industry,Ozonetel is leading Cloud Telephony solution provider.,"CSN Murthy, Atul Sharma",Stakeboat Capital,5000000.0,Early Traction,2021
CoinSwitch Kuber,2017,Bangalore,Finance And Technology,"CoinSwitch Kuber is the largest crypto trading platform in India with a user base of 10M+, in just 15 months and growing every second.","Ashish Singhal, Govind Soni, Vimal Sagar Tiwari","Coinbase Ventures, Andreessen Horowitz",260000000.0,Scaling,2021
Pazcare,2020,Bangalore,Finance And Technology,Paz Care is India's leading Employee Benefits & Health insurance platform,"Sanchit Malik, Manish Mishra","BEENEXT, 3one4 Capital",3500000.0,Validation,2021
kWh Bikes,2020,Bangalore,Automotive,Building India’s strongest and smartest electric 2 wheelers,"Siddharth Janghu, Kartik Gupta, Anupriya","Let’s Venture, Better Capital",2000000.0,Validation,2021
IBSFINtech,2006,Bangalore,Technology And Software,"Driving Digitization & Automation of Cash & Liquidity, Risk, Treasury & Trade Finance functions of the Corporate.","C M Grover, TM Manjunath",Not filled,1000000.0,Validation,2021
LeadSquared,2011,Bangalore,Technology And Software,"LeadSquared is a marketing automation and sales execution platform that helps businesses increase their closures, manage their pipelines",Nilesh Patel,International Finance Corporation,4000000.0,Debt,2021
Phool.co,2017,Kanpur,Energy And Environment,Flowercycling technologies to upcycle cellulose waste and specialises in manufacturing charcoal-free incense and other wellness products,Ankit Agarwal,"Alia Bhatt, IAN Fund, Social Alpha, Draper Richards Kaplan Foundation",4000000.0,Debt,2021
Twin Health,2018,Chennai,Healthcare And Health Technology,Twin Health invented the Whole Body Digital Twin™ to help reverse and prevent chronic metabolic diseases.,Jahangir Mohammed,"Sequoia Capital India, ICONIQ Capital, Perceptive Advisors",140000000.0,Scaling,2021
Trica,2021,Mumbai,Technology And Software,Powering private markets - A technology platform for startups and investors.,Nimesh Kampani,LetsVenture,3000000.0,Validation,2021
mHealth,2020,New Delhi,Healthcare And Health Technology,mHealth  is AI based corporate wellness platform  to spread happiness & well-being,"Rajesh Munjal, Balwinder Singh, Monika Garg",India Accelerator,4000000.0,Validation,2021
Rebel Foods,2011,Mumbai,Technology And Software,"World’s largest internet restaurant company. Building Unique, Memorable, Delightful & Sure delivery-only restaurants.","Jaydeep Barman, Kallol Banerjee.",Qatar Investment Authority,175000000.0,Scaling,2021
ProfitWheel,2020,Mumbai,Marketing And Advertising,ProfitWheel's belief is that only a fraction of customers drive the most profitability for a brand - and we want to help increase their high value customer base.,"Vivek Bhargava, Gautam Mehra, Aman Khanna","Netcore Cloud, Vallabh Bhansali, Jimmy Mahtani",3000000.0,Validation,2021
Log 9 Materials,2014,Bangalore,Energy And Environment,Log9 Materials is on a mission to make global energy 100% clean.,Akshay Singhal,Petronas Ventures,2000000.0,Debt,2021
Chingari,2018,Bangalore,Technology And Software,"Chingari - Bharat Ka Super Entertainment App. A unique and fun short video app, can create interesting videos and share them with the world.",Sumit Ghosh,Solana,19000000.0,Equity,2021
Ishitva,2018,Ahmedabad,Technology And Software,"Sort to create value’ using #AI, #Robotics and #AirSorter to achieve a #circulareconomy with environmental benefits.",Jitesh Dadlani,Inflection Point Ventures,1000000.0,Validation,2021
Ola Electric,2017,Bangalore,Automotive,Sustainability for the future.,Bhavish Aggarwal,"Falcon Edge, Softbank",200000000.0,Scaling,2021
leap.club,2014,Gurugram,Technology And Software,A community-led professional network for women,"Ragini Das, Anand Sinha","Enzia Ventures, Kunal Shah",810000.0,Validation,2021
F5,2018,New Delhi,E-Commerce And Retail,One-Stop Solution for Daily Workplace Needs,"Raghav Arora, Lalit Aggarwal",Auxano Capital,600000.0,Validation,2021
ForeignAdmits,2018,Bangalore,Education And Learning,“foreignadmits” aims at addressing one of the biggest problems of personalized mentoring for students aiming to pursue higher education and eventually become an expert in their desired discipline of study.,"Nikhil Jain, Ashwini Jain",Unicorn India Ventures,400000.0,Validation,2021
SALT,2019,Bangalore,Finance And Technology,Salt is a neo-banking experience created to cater to international businesses.,"Ankit Parasher, Udita Pal","Prashant Pansare, Supermorpheus",500000.0,Ideation,2021
EarnWealth,2014,Pune,Finance And Technology,"EarnWealth is India's First Social Commerce FinTech which enables Financial Consultants, Mutual Fund Distributors, Insurance Agents, Real Estate Consultants, Housewives, Retired People and Students to earn quick money by selling Loans, Credit Cards",Rajesh P Nair,Not filled,500000.0,Validation,2021
Visit Health,2015,New Delhi,Healthcare And Health Technology,"Visit is a 360° integrated, highly engaging Health Benefits Platform- covering end to end health & wellness management.","Shashvat Tripathi, Anurag Prasad, Vaibhav Singh, Chetan Anand",Docprime Technologies,7500000.0,Equity,2021
Crater.Club,2020,Bangalore,Media And Entertainment,"Crater is where you join 5000+ mentors, creators & experts while they stream their knowledge and skills live.","Vignesh Prasad, Vivan Puri",LC Nueva AIF,700000.0,Validation,2021
NFTically,2021,Gurugram,Media And Entertainment,"NFTically is a global B2B SaaS that enables celebrities, influencers, gamers, clubs & enterprises to launch their own white-label NFT store or NFT Marketplace without any technical knowledge.",Toshendra Sharma,"Nitish Mittersain, Gaurav Munjal",1000000.0,Validation,2021
ReshaMandi,2020,Bangalore,E-Commerce And Retail,"ReshaMandi provides a full-stack digital ecosystem in the form of a super app, from FARM to RETAIL.",Utkarsh Apoorva,"9Unicorns, Venture Catalysts, Sandeep Singhal",30000000.0,Early Traction,2021
Zetwerk,2018,Bangalore,Technology Solutions For Industry,ZETWERK is a universal manufacturing network powered by new-age technology.,Amrit Acharya,TradeCred,600000000.0,Scaling,2021
Hubilo,2020,Ahmedabad,Technology And Software,Hubilo is the leading hybrid event platform built for engagement and event excellence.,"Mayank Agarwal, Vaibhav Jain",Alkeon Capital,125000000.0,Scaling,2021
M2P Fintech,2015,Chennai,Finance And Technology,"M2P fintech was born out of the need to build highly scalable, secure yet nimble technology stack at the intersection of Mobility, Commerce and payments.",Madhusudanan R,Tiger Global,35000000.0,Scaling,2021
Open Financial Technologies,2017,Bangalore,Finance And Technology,Open is Asia’s first neobanking platform for SMEs and startups.,Anish Achuthan,"Temasek, Google, SBI Investment",90000000.0,Scaling,2021
Niro,2021,Bangalore,Finance And Technology,Embedding personal credit products into leading consumer internet platforms.,"Aditya Kumar, Sankalp Mathur",Elevar Equity,3500000.0,Validation,2021
Wiingy,2021,Bangalore,Education And Learning,The ultimate 1:1 live e-learning platform providing personalized hands-on learning for kids,Asit Biswal,Aroa Ventures,400000.0,Debt,2021
CarDekho,2008,Jaipur,Automotive,Redefining the country’s personal mobility ecosystem with technologically enhanced solutions.,"Amit Jain, Anurag Jain",Not filled,250000000.0,Scaling,2021
Melorra,2015,Bangalore,E-Commerce And Retail,A company that styles jewellery for the contemporary wardrobe.,Saroja Yeramili,"9Unicorns, Symphony International Holdings Limited, Value Quest",24000000.0,Equity,2021
AnKa SumMor,2017,Bangalore,E-Commerce And Retail,"AnKa SumMor is the service that allows businesses to focus on building their brands, while they provide Supply & Distribution expertise.","Rajiv Joshi, Ashok George",Inflection Point Ventures,1000000.0,Validation,2021
Toch.ai,2016,Mumbai,Technology And Software,"Toch is an AI-driven platform that helps broadcasters, OTT platforms, media platforms, and creators to revolutionize videos.","Vinayak Shrivastav, Saket Dandotia, Alok Patil",Not filled,11000000.0,Early Traction,2021
Playto Labs,2021,Bangalore,Education And Learning,Playto Labs provides robotics toys and online classes for kids to help them develop the key 21st century skills. Book a free trial for your child today at www.playtolabs.com,Pavan Ponnaganti,Inflection Point Ventures,500000.0,Validation,2021
Fraazo,2020,Mumbai,Consumer Goods And Services,FRAAZO is Mumbai's favourite App for Fresh Vegetables and Fruits coming straight from the Farm to your Doorstep within 18 Hours.,"Atul Kumar, Aashish Krishnatre",WestBridge Capital,50000000.0,Scaling,2021
Arcana,2019,Bangalore,Technology And Software,Arcana offers a Privacy Stack SDK to DApp developers on EVM compatible blockchains chains to build Privacy-First products.,"Mayur Relekar, Aravindh Kumar, Abhishek Chaudhary","Republic Crypto, Woodstock, DCG, Sahil Lavingia",2300000.0,Debt,2021
FloCareer,2018,Bangalore,Human Resources And Consultancy,"The Best Skills Validation Platform that provides ""Interview As-A-Service""?.","Mohit Jain,  Mehul Bhatt",Data Point Capital,5700000.0,Early Traction,2021
Nap Chief,2019,Mumbai,Technology And Software,India's favourite Kid's wear and Family Sleepwear D2C Brand,Raghav Gupta,Titan Capital,200000.0,Validation,2021
AcknoLedger,2021,Mumbai,Finance And Technology,AcknoLedger is a Global platform that distributes Web 3.0 Digital Assets Seamlessly across all the Metaverses and Gaming,Yash Dahenkar,"Momentum 6, Basics Capital, Krypital Capital, Shima Capital, Magnus Capital",1500000.0,Validation,2021
ApplicateAI,2014,Gurugram,Technology And Software,"‘ApplicateAI’ is an integrated AI BOT platform for Enterprise with defined and curated work-flows for Sales, Consumer Engagement and Employee support and engagement.","Madhusudan Atmakuri, Ranjeet Kumar",Not filled,30000000.0,Early Traction,2021
VLCC Health Care,1989,Gurugram,Healthcare And Health Technology,VLCC is today widely recognized for its comprehensive portfolio of beauty and wellness products and services,Vandana Luthra,Not filled,4000000.0,Debt,2021
Aviom India,2016,Bhilwara,Finance And Technology,AVIOM India Housing Finance Pvt. Ltd. is a venture started by experienced professionals with a vision to improve the standard of living of families from the informal sector in rural areas,Kajal Ilmi,Sabre Partners,8000000.0,Scaling,2021
Onato,2021,Bangalore,Technology And Software,A startup solving inefficiencies in the agri supply chain,"Vedant Katiyar, Ashish Jindal","Vertex Ventures, Omnivore",2200000.0,Debt,2021
Mestastop Solutions,2018,Bangalore,Technology And Software,"Mestastop aims to provide a solution for such challenges with their unique proprietary platforms, METAssay, METSCAN, and METVivo.",Dr Arnab Roy Chowdhury,CIIE.CO,100000.0,Debt,2021
SaaS Labs,2016,Noida,Technology And Software,"Building high impact communication, workflow and productivity tools for sales and support teams throughout the globe.",Gaurav Sharma,"Base 10 Partners, Eight Roads Ventures",17000000.0,Early Traction,2021
Devnagri,2017,Noida,Technology And Software,"Devnagri is an AI powered human translation platform, working in all 22 Indian languages.","Nakul Kundra, Himanshu Sharma","enture Catalyst, IPV",600000.0,Validation,2021
CRED,2018,Bangalore,Finance And Technology,CRED is a credit card payment platform that rewards users with points for paying their bills.,Kunal Shah,"Tiger Global, Falcon Edge",250000000.0,Scaling,2021
ConveGenius,2013,Noida,Education And Learning,An EdTech social enterprise focused on closing the gap in educational achievement for children and youth in India.,"Jairaj Bhattacharya, Shashank Pandey","BAce Capital, Heritas Capital, 3Lines Venture Capital",5000000.0,Ideation,2021
Totality,2017,Gurugram,Technology And Software,"Totality with the goal of combining scalability through technology, innovation through design & retention through content.",Anshul Rustaggi,"Leo Capital, Mayfield Fund",1000000.0,Debt,2021
CredAble,2017,Mumbai,Finance And Technology,CredAble provides liquidity programs for enterprise supply chains.,Nirav Choksi,"Plutus Wealth, Oaks Asset Management",30000000.0,Scaling,2021
MarketWolf,2017,Mumbai,Finance And Technology,"MarketWolf provides everyone an opportunity to begin their trading journey with a unique digital platform that is bold, simple and fun.","Vishesh Dhingra, Thomas Joseph","Anil Thadani, Ashutosh Sinha, Roy van Leeuwen",5500000.0,Validation,2021
Wondrlab,2020,Mumbai,Marketing And Advertising,India's largest platform-first martech startup,Saurabh Varma,"Pi Ventures LLP, Tanas Capital, Prodapt Holdings",7000000.0,Validation,2021
SUN Mobility,2017,Bangalore,Automotive,Provider of universal energy infrastructure and services to accelerate mass EV usage!,Chetan Maini,Vitol,50000000.0,Equity,2021
Tamasha,2020,Mumbai,Technology And Software,"Tamasha, the next-generation interactive entertainment platform.","Saurabh Gupta, Siddharth Swarnkar",Chiratae Ventures,3000000.0,Validation,2021
Revfin,2017,New Delhi,Finance And Technology,"RevFin is a financial technology (FinTech) company, advanced digital lending platform makes getting a loan convenient and accessible for customers",Sameer Aggarwal,"Ruchirans Jaipuria, Rishi Kajaria",4000000.0,Validation,2021
Yu Foodlabs,2020,Gurugram,Consumer Goods And Services,Re-imagining Packaged Foods with Natural Ingredients & ZERO Preservatives,"Bharat Bhalla, Varun Kapur","Manish Choksi, Varun Vakil",1000000.0,Validation,2021
MergerDomo,2018,New Delhi,Finance And Technology,MergerDomo is the one-stop Global OnLine M&A marketplace for Corporate and Business Growth,Hormazd Charna,Nadir B Godrej,500000.0,Debt,2021
FarMart,2015,Gurugram,Agriculture And Technology,FarMart is an agritech platform that helps businesses easily source high quality produce at reasonable prices.,"Alekh Sanghera, Mehtab Singh Hans",Matrix Partners India,10000000.0,Early Traction,2021
Questt,2020,Gurugram,Education And Learning,Questt is a Free online homework app that lets teachers assign gamified homework to students.,"Akhil, Mohsin M, Rohit Pande",Celesta Capital,6750000.0,Early Traction,2021
IDfy,2011,Mumbai,Technology And Software,IDfy helps people and business build authentic relationships by ensuring that both parties are who they claim to be and can be trusted.,Ashok Hariharan,"TransUnion, Blume Ventures",10000000.0,Scaling,2021
ClearDekho,2016,Ghaziabad,E-Commerce And Retail,ClearDekho is India’s Leading Affordable Eyewear Brand.,"Saurabh Dayal, Shivi Singh",Aroa Ventures,4000000.0,Validation,2021
